ASD Acronym,Designation,Title of Standard,Abstract,Link
FDA,Guidance,M13B Bioequivalence for Immediate-Release Solid Oral Dosage Forms: Additional Strengths Biowaiver: Draft Guidance for Industry,Visit the link for more information,https://www.fda.gov/regulatory-information/search-fda-guidance-documents/m13b-bioequivalence-immediate-release-solid-oral-dosage-forms-additional-strengths-biowaiver
FDA,Guidance,Replacing Color Additives in Approved or Marketed Drug Products,Visit the link for more information,https://www.fda.gov/regulatory-information/search-fda-guidance-documents/replacing-color-additives-approved-or-marketed-drug-products
FDA,Guidance,"Electronic Submission Template for Medical Device Q-Submissions",Visit the link for more information,https://www.fda.gov/regulatory-information/search-fda-guidance-documents/electronic-submission-template-medical-device-q-submissions
FDA,Guidance,"Requests for Feedback and Meetings for Medical Device Submissions:The Q-Submission Program",Visit the link for more information,https://www.fda.gov/regulatory-information/search-fda-guidance-documents/requests-feedback-and-meetings-medical-device-submissions-q-submission-program
FDA,Guidance,"Recommendations to Reduce the Risk of Transmission of Disease Agents Associated with Sepsis by Human Cells, Tissues, and Cellular and Tissue-Based Products (HCT/Ps):  Guidance for Industry",Visit the link for more information,https://www.fda.gov/regulatory-information/search-fda-guidance-documents/recommendations-reduce-risk-transmission-disease-agents-associated-sepsis-human-cells-tissues-and
FDA,Guidance,"Recommendations to Reduce the Risk of Transmission of Mycobacterium tuberculosis (Mtb) by Human Cells, Tissues, and Cellular and Tissue-Based Products (HCT/Ps):  Guidance for Industry",Visit the link for more information,https://www.fda.gov/regulatory-information/search-fda-guidance-documents/recommendations-reduce-risk-transmission-mycobacterium-tuberculosis-mtb-human-cells-tissues-and
FDA,Guidance,Evaluation of Sex-Specific Data in Medical Device Clinical Studies,Visit the link for more information,https://www.fda.gov/media/82005/download
FDA,Guidance,Study Data Technical Conformance Guide - Technical Specifications Document,Visit the link for more information,https://www.fda.gov/media/153632/download 
FDA,Guidance,Data Standards Catalog,Visit the link for more information,https://www.fda.gov/regulatory-information/search-fda-guidance-documents/data-standards-catalog
FDA,Guidance,Institutional Review Boards Frequently Asked Questions:  Guidance for Institutional Review Boards and Clinical Investigators,Visit the link for more information,https://www.fda.gov/regulatory-information/search-fda-guidance-documents/institutional-review-boards-frequently-asked-questions
FDA,Guidance,Institutional Review Board (IRB) Written Procedures:  Guidance for Institutions and IRBs,Visit the link for more information,https://www.fda.gov/regulatory-information/search-fda-guidance-documents/institutional-review-board-irb-written-procedures
FDA,Guidance,Evaluation of Sex Differences in Clinical Investigations:  Guidance for Industry,Visit the link for more information,https://www.fda.gov/regulatory-information/search-fda-guidance-documents/evaluation-sex-differences-clinical-investigations
FDA,Guidance,Prevention and Treatment of Chemotherapy-Induced Peripheral Neuropathy: Developing Drug and Biological Products in Oncology,Visit the link for more information,https://www.fda.gov/regulatory-information/search-fda-guidance-documents/prevention-and-treatment-chemotherapy-induced-peripheral-neuropathy-developing-drug-and-biological
FDA,Guidance,Recommendations to Reduce the Risk of Transfusion-Transmitted Malaria: Draft Guidance for Industry,Visit the link for more information,https://www.fda.gov/regulatory-information/search-fda-guidance-documents/recommendations-reduce-risk-transfusion-transmitted-malaria-0
FDA,Guidance,Premarket Approval Application and Humanitarian Device Exemption Modular Review:  Guidance for Industry and FDA Staff,Visit the link for more information,https://www.fda.gov/regulatory-information/search-fda-guidance-documents/premarket-approval-application-and-humanitarian-device-exemption-modular-review
FDA,Guidance,CVM GFI #187B Heritable Intentional Genomic Alterations in Animals: The Approval Process,Visit the link for more information,https://www.fda.gov/regulatory-information/search-fda-guidance-documents/cvm-gfi-187b-heritable-intentional-genomic-alterations-animals-approval-process
FDA,Guidance,CVM GFI #294 - Animal Food Ingredient Consultation (AFIC),Visit the link for more information,https://www.fda.gov/regulatory-information/search-fda-guidance-documents/cvm-gfi-294-animal-food-ingredient-consultation-afic
FDA,Guidance,Accelerated Approval and Considerations for Determining Whether a Confirmatory Trial is Underway,Visit the link for more information,https://www.fda.gov/regulatory-information/search-fda-guidance-documents/accelerated-approval-and-considerations-determining-whether-confirmatory-trial-underway
FDA,Guidance,Considerations for Including Tissue Biopsies in Clinical Trials,Visit the link for more information,https://www.fda.gov/regulatory-information/search-fda-guidance-documents/considerations-including-tissue-biopsies-clinical-trials
FDA,Guidance,CVM GFI #251 - Heritable Intentional Genomic Alterations in Animals of Food-Producing Species for Use as Models of Disease,Visit the link for more information,https://www.fda.gov/regulatory-information/search-fda-guidance-documents/cvm-gfi-251-heritable-intentional-genomic-alterations-animals-food-producing-species-use-models
FDA,Guidance,CVM GFI #260 - Type VII Veterinary Master File for Research and Development and Risk Reviews,Visit the link for more information,https://www.fda.gov/regulatory-information/search-fda-guidance-documents/cvm-gfi-260-type-vii-veterinary-master-file-research-and-development-and-risk-reviews
FDA,Guidance,Developing Drugs for Optical Imaging,Visit the link for more information,https://www.fda.gov/regulatory-information/search-fda-guidance-documents/developing-drugs-optical-imaging
FDA,Guidance,Obesity and Overweight: Developing Drugs and Biological Products for Weight Reduction,Visit the link for more information,https://www.fda.gov/regulatory-information/search-fda-guidance-documents/obesity-and-overweight-developing-drugs-and-biological-products-weight-reduction
FDA,Guidance,"Pulse Oximeters for Medical Purposes - Non-Clinical and Clinical Performance Testing, Labeling, and Premarket Submission Recommendations: Draft Guidance for Industry and  Food and Drug Administration Staff",Visit the link for more information,https://www.fda.gov/regulatory-information/search-fda-guidance-documents/pulse-oximeters-medical-purposes-non-clinical-and-clinical-performance-testing-labeling-and
FDA,Guidance,Notifying FDA of a Permanent Discontinuance or Interruption in Manufacturing of a Device Under Section 506J of the FD&C Act:  Guidance for Industry and Food and Drug Administration Staff,Visit the link for more information,https://www.fda.gov/regulatory-information/search-fda-guidance-documents/notifying-fda-permanent-discontinuance-or-interruption-manufacturing-device-under-section-506j-fdc
FDA,Guidance,Artificial Intelligence-Enabled Device Software Functions: Lifecycle Management and Marketing Submission Recommendations: Draft Guidance for Industry and Food and Drug Administration Staff,Visit the link for more information,https://www.fda.gov/regulatory-information/search-fda-guidance-documents/artificial-intelligence-enabled-device-software-functions-lifecycle-management-and-marketing
FDA,Guidance,Considerations for the Use of Artificial Intelligence To Support Regulatory Decision-Making for Drug and Biological Products: Draft Guidance for Industry and Other Interested Parties,Visit the link for more information,https://www.fda.gov/regulatory-information/search-fda-guidance-documents/considerations-use-artificial-intelligence-support-regulatory-decision-making-drug-and-biological
FDA,Guidance,Communications From Firms to Health Care Providers Regarding Scientific Information on Unapproved Uses of Approved/Cleared Medical Products: Questions and Answers,Visit the link for more information,https://www.fda.gov/regulatory-information/search-fda-guidance-documents/communications-firms-health-care-providers-regarding-scientific-information-unapproved-uses
FDA,Guidance,"Guidance for FDA Staff and Interested Parties: Evaluating the Public Health Importance of Food Allergens Other Than the Major Food Allergens Listed in the Federal Food, Drug, and Cosmetic Act",Visit the link for more information,https://www.fda.gov/regulatory-information/search-fda-guidance-documents/guidance-fda-staff-and-interested-parties-evaluating-public-health-importance-food-allergens-other
FDA,Guidance,Guidance for Industry: Action Levels for Lead in Processed Food Intended for Babies and Young Children,Visit the link for more information,https://www.fda.gov/regulatory-information/search-fda-guidance-documents/guidance-industry-action-levels-lead-processed-food-intended-babies-and-young-children
FDA,Guidance,Guidance for Industry: Questions and Answers Regarding Food Allergen Labeling (Edition 5),Visit the link for more information,https://www.fda.gov/regulatory-information/search-fda-guidance-documents/guidance-industry-questions-and-answers-regarding-food-allergen-labeling-edition-5
FDA,Guidance,"Interim Policy on Compounding Using Bulk Drug Substances Under Section 503A of the Federal Food, Drug, and Cosmetic Act",Visit the link for more information,https://www.fda.gov/regulatory-information/search-fda-guidance-documents/interim-policy-compounding-using-bulk-drug-substances-under-section-503a-federal-food-drug-and
FDA,Guidance,"Interim Policy on Compounding Using Bulk Drug Substances Under Section 503B of the Federal Food, Drug, and Cosmetic Act",Visit the link for more information,https://www.fda.gov/regulatory-information/search-fda-guidance-documents/interim-policy-compounding-using-bulk-drug-substances-under-section-503b-federal-food-drug-and
FDA,Guidance,Validation and Verification of Analytical Testing Methods Used for Tobacco Products,Visit the link for more information,https://www.fda.gov/regulatory-information/search-fda-guidance-documents/validation-and-verification-analytical-testing-methods-used-tobacco-products
FDA,Guidance,Considerations for Complying with 21 CFR 211.110,Visit the link for more information,https://www.fda.gov/regulatory-information/search-fda-guidance-documents/considerations-complying-21-cfr-211110
FDA,Guidance,Draft Guidance for Industry: Establishing Sanitation Programs for Low-Moisture Ready-to-Eat Human Foods and Taking Corrective Actions Following a Pathogen Contamination Event,Visit the link for more information,https://www.fda.gov/regulatory-information/search-fda-guidance-documents/draft-guidance-industry-establishing-sanitation-programs-low-moisture-ready-eat-human-foods-and
FDA,Guidance,Draft Guidance for Industry: Labeling of Plant-Based Alternatives to Animal-Derived Foods,Visit the link for more information,https://www.fda.gov/regulatory-information/search-fda-guidance-documents/draft-guidance-industry-labeling-plant-based-alternatives-animal-derived-foods
FDA,Guidance,"Recommendations for Determining Eligibility of Donors of Human Cells, Tissues, and Cellular and Tissue-Based Products (HCT/Ps): Draft Guidance for Industry",Visit the link for more information,https://www.fda.gov/regulatory-information/search-fda-guidance-documents/recommendations-determining-eligibility-donors-human-cells-tissues-and-cellular-and-tissue-based
FDA,Guidance,"Recommendations to Reduce the Risk of Transmission of Hepatitis B Virus (HBV) by Human Cells, Tissues, and Cellular and Tissue-Based Products (HCT/Ps): Draft Guidance for Industry",Visit the link for more information,https://www.fda.gov/regulatory-information/search-fda-guidance-documents/recommendations-reduce-risk-transmission-hepatitis-b-virus-hbv-human-cells-tissues-and-cellular-and
FDA,Guidance,"Recommendations to Reduce the Risk of Transmission of Hepatitis C Virus (HCV) by Human Cells, Tissues, and Cellular and Tissue-Based Products (HCT/Ps): Draft Guidance for Industry",Visit the link for more information,https://www.fda.gov/regulatory-information/search-fda-guidance-documents/recommendations-reduce-risk-transmission-hepatitis-c-virus-hcv-human-cells-tissues-and-cellular-and
FDA,Guidance,"Recommendations to Reduce the Risk of Transmission of Human Immunodeficiency Virus (HIV) by Human Cells, Tissues, and Cellular and Tissue-Based Products (HCT/Ps): Draft Guidance for Industry",Visit the link for more information,https://www.fda.gov/regulatory-information/search-fda-guidance-documents/recommendations-reduce-risk-transmission-human-immunodeficiency-virus-hiv-human-cells-tissues-and
FDA,Guidance,Validation of Certain In Vitro Diagnostic Devices for Emerging Pathogens During a Section 564 Declared Emergency: Draft Guidance for Industry and Food and Drug Administration Staff,Visit the link for more information,https://www.fda.gov/regulatory-information/search-fda-guidance-documents/validation-certain-in-vitro-diagnostic-devices-emerging-pathogens-during-section-564-declared-emergency
FDA,Guidance,Advanced Manufacturing Technologies Designation Program,Visit the link for more information,https://www.fda.gov/regulatory-information/search-fda-guidance-documents/advanced-manufacturing-technologies-designation-program
FDA,Guidance,E11A Pediatric Extrapolation,Visit the link for more information,https://www.fda.gov/regulatory-information/search-fda-guidance-documents/e11a-pediatric-extrapolation
FDA,Guidance,E6(R3) Good Clinical Practice: Annex 2,Visit the link for more information,https://www.fda.gov/regulatory-information/search-fda-guidance-documents/e6r3-good-clinical-practice-annex-2
FDA,Guidance,M15 General Principles for Model-Informed Drug Development,Visit the link for more information,https://www.fda.gov/regulatory-information/search-fda-guidance-documents/m15-general-principles-model-informed-drug-development
FDA,Guidance,"Protocol Deviations for Clinical Investigations of Drugs, Biological Products, and Devices",Visit the link for more information,https://www.fda.gov/regulatory-information/search-fda-guidance-documents/protocol-deviations-clinical-investigations-drugs-biological-products-and-devices
FDA,Guidance,Combined Food and Drug Administration and Sponsor Oncologic Drugs Advisory Committee Briefing Document,Visit the link for more information,https://www.fda.gov/regulatory-information/search-fda-guidance-documents/combined-food-and-drug-administration-and-sponsor-oncologic-drugs-advisory-committee-briefing
FDA,Guidance,Global Unique Device Identification Database (GUDID):  Guidance for Industry and Food and Drug Administration Staff,Visit the link for more information,https://www.fda.gov/regulatory-information/search-fda-guidance-documents/global-unique-device-identification-database-gudid
FDA,Guidance,Technical Specifications for Submitting Clinical Trial Data Sets for Treatment of Noncirrhotic Nonalcoholic Steatohepatitis (NASH):  Guidance for Industry Technical Specifications Document,Visit the link for more information,https://www.fda.gov/regulatory-information/search-fda-guidance-documents/technical-specifications-submitting-clinical-trial-data-sets-treatment-noncirrhotic-nonalcoholic
FDA,Guidance,Guidance for Industry:  Registration and Listing of Cosmetic Product Facilities and Products,Visit the link for more information,https://www.fda.gov/regulatory-information/search-fda-guidance-documents/guidance-industry-registration-and-listing-cosmetic-product-facilities-and-products
FDA,Guidance,Standardized Format for Electronic Submission of NDA and BLA Content for the Planning of Bioresearch Monitoring (BIMO) Inspections for CDER Submissions Guidance for Industry,Visit the link for more information,https://www.fda.gov/regulatory-information/search-fda-guidance-documents/standardized-format-electronic-submission-nda-and-bla-content-planning-bioresearch-monitoring-bimo
FDA,Guidance,Accelerated Approval – Expedited Program for Serious Conditions,Visit the link for more information,https://www.fda.gov/regulatory-information/search-fda-guidance-documents/accelerated-approval-expedited-program-serious-conditions
FDA,Guidance,CVM GFI #49 Evaluating Target Animal Safety and Effectiveness of Antibacterial New Animal Drugs for Bovine Mastitis,Visit the link for more information,https://www.fda.gov/regulatory-information/search-fda-guidance-documents/cvm-gfi-49-evaluating-target-animal-safety-and-effectiveness-antibacterial-new-animal-drugs-bovine
FDA,Guidance,Marketing Submission Recommendations for a Predetermined Change Control Plan for Artificial Intelligence-Enabled Device Software Functions:  Guidance for Industry and Food and Drug Administration Staff,Visit the link for more information,https://www.fda.gov/regulatory-information/search-fda-guidance-documents/marketing-submission-recommendations-predetermined-change-control-plan-artificial-intelligence
FDA,Guidance,Draft Guidance for Industry: Notifying FDA of a Permanent Discontinuance in the Manufacture or an Interruption of the Manufacture of an Infant Formula,Visit the link for more information,https://www.fda.gov/regulatory-information/search-fda-guidance-documents/draft-guidance-industry-notifying-fda-permanent-discontinuance-manufacture-or-interruption
FDA,Guidance,Use of Circulating Tumor Deoxyribonucleic Acid for Early-Stage Solid Tumor Drug Development; Guidance for Industry; Availability,Visit the link for more information,https://www.fda.gov/regulatory-information/search-fda-guidance-documents/use-circulating-tumor-deoxyribonucleic-acid-early-stage-solid-tumor-drug-development-guidance
FDA,Guidance,Recommended Followup Testing for an Ames-Positive Drug (Active Ingredient) or Metabolite To Support First-in-Human Clinical Trials With Healthy Subjects,Visit the link for more information,https://www.fda.gov/regulatory-information/search-fda-guidance-documents/recommended-followup-testing-ames-positive-drug-active-ingredient-or-metabolite-support-first-human
FDA,Guidance,Assessment of Ovarian Toxicity in Premenopausal Adults During Drug Development for Oncologic Products,Visit the link for more information,https://www.fda.gov/regulatory-information/search-fda-guidance-documents/assessment-ovarian-toxicity-premenopausal-adults-during-drug-development-oncologic-products
FDA,Guidance,Transitional Enforcement Policy for Ethylene Oxide Sterilization Facility Changes for Class III Devices:  Guidance for Industry and Food and Drug Administration Staff,Visit the link for more information,https://www.fda.gov/regulatory-information/search-fda-guidance-documents/transitional-enforcement-policy-ethylene-oxide-sterilization-facility-changes-class-iii-devices
FDA,Guidance,"Orthopedic Non-Spinal Bone Plates, Screws, and Washers - Premarket Notification (510(k)) Submissions:  Guidance for Industry and Food and Drug Administration Staff",Visit the link for more information,https://www.fda.gov/regulatory-information/search-fda-guidance-documents/orthopedic-non-spinal-bone-plates-screws-and-washers-premarket-notification-510k-submissions
FDA,Guidance,Orthopedic Non-Spinal Metallic Bone Screws and Washers - Performance Criteria for Safety and Performance Based Pathway:  Guidance for Industry and Food and Drug Administration Staff,Visit the link for more information,https://www.fda.gov/regulatory-information/search-fda-guidance-documents/orthopedic-non-spinal-metallic-bone-screws-and-washers-performance-criteria-safety-and-performance
FDA,Guidance,"510(k) Third Party Review Program and Third Party Emergency Use Authorization (EUA) Review:  Guidance for Industry, Food and Drug Administration Staff, and Third Party Review Organizations",Visit the link for more information,https://www.fda.gov/regulatory-information/search-fda-guidance-documents/510k-third-party-review-program-and-third-party-emergency-use-authorization-eua-review
FDA,Guidance,Frequently Asked Questions — Developing Potential Cellular and Gene Therapy Products,Visit the link for more information,https://www.fda.gov/regulatory-information/search-fda-guidance-documents/frequently-asked-questions-developing-potential-cellular-and-gene-therapy-products
FDA,Guidance,Nonclinical Safety Assessment of Oligonucleotide-Based Therapeutics,Visit the link for more information,https://www.fda.gov/regulatory-information/search-fda-guidance-documents/nonclinical-safety-assessment-oligonucleotide-based-therapeutics
FDA,Guidance,Guidance for Industry: FDA's Voluntary Qualified Importer Program,Visit the link for more information,https://www.fda.gov/regulatory-information/search-fda-guidance-documents/guidance-industry-fdas-voluntary-qualified-importer-program
FDA,Guidance,CPG Sec 540.525 Scombrotoxin (Histamine)-forming Fish and Fishery Products – Decomposition and Histamine (CPG 7108.24),Visit the link for more information,https://www.fda.gov/regulatory-information/search-fda-guidance-documents/cpg-sec-540525-scombrotoxin-histamine-forming-fish-and-fishery-products-decomposition-and-histamine
FDA,Guidance,Study Data Technical Conformance Guide - Technical Specifications Document,Visit the link for more information,https://www.fda.gov/regulatory-information/search-fda-guidance-documents/study-data-technical-conformance-guide-technical-specifications-document
FDA,Guidance,M13A Bioequivalence for Immediate-Release Solid Oral Dosage Forms,Visit the link for more information,https://www.fda.gov/regulatory-information/search-fda-guidance-documents/m13a-bioequivalence-immediate-release-solid-oral-dosage-forms
FDA,Guidance,CVM GFI #293 - FDA Enforcement Policy for AAFCO-Defined Animal Feed Ingredients,Visit the link for more information,https://www.fda.gov/regulatory-information/search-fda-guidance-documents/cvm-gfi-293-fda-enforcement-policy-aafco-defined-animal-feed-ingredients
FDA,Guidance,"Guidance for Industry: Insanitary Conditions in the Preparation, Packing, and Holding of Tattoo Inks and the Risk of Microbial Contamination",Visit the link for more information,https://www.fda.gov/regulatory-information/search-fda-guidance-documents/guidance-industry-insanitary-conditions-preparation-packing-and-holding-tattoo-inks-and-risk
FDA,Guidance,Drug Interaction Information in Human Prescription Drug and Biological Product Labeling,Visit the link for more information,https://www.fda.gov/regulatory-information/search-fda-guidance-documents/drug-interaction-information-human-prescription-drug-and-biological-product-labeling
FDA,Guidance,Review of Drug Master Files in Advance of Certain ANDA Submissions Under GDUFA,Visit the link for more information,https://www.fda.gov/regulatory-information/search-fda-guidance-documents/review-drug-master-files-advance-certain-anda-submissions-under-gdufa
FDA,Guidance,Postoperative Nausea and Vomiting: Developing Drugs for Prevention,Visit the link for more information,https://www.fda.gov/regulatory-information/search-fda-guidance-documents/postoperative-nausea-and-vomiting-developing-drugs-prevention
FDA,Guidance,"Recommendations for the Development of Blood Collection, Processing, and Storage Systems for the Manufacture of Blood Components Using the Buffy Coat Method",Visit the link for more information,https://www.fda.gov/regulatory-information/search-fda-guidance-documents/recommendations-development-blood-collection-processing-and-storage-systems-manufacture-blood
FDA,Guidance,Considerations for Long-Term Clinical Neurodevelopmental Safety Studies in Neonatal Product Development:  Guidance for Industry,Visit the link for more information,https://www.fda.gov/regulatory-information/search-fda-guidance-documents/considerations-long-term-clinical-neurodevelopmental-safety-studies-neonatal-product-development
FDA,Guidance,Core Patient-Reported Outcomes in Cancer Clinical Trials:  Guidance for Industry,Visit the link for more information,https://www.fda.gov/regulatory-information/search-fda-guidance-documents/core-patient-reported-outcomes-cancer-clinical-trials
FDA,Guidance,Requests for Reconsideration at the Division Level Under GDUFA,Visit the link for more information,https://www.fda.gov/regulatory-information/search-fda-guidance-documents/requests-reconsideration-division-level-under-gdufa
FDA,Guidance,CVM GFI #284 Using Relative Supersaturation to Support “Urinary Tract Health” Claims for Adult Maintenance Cat Food,Visit the link for more information,https://www.fda.gov/regulatory-information/search-fda-guidance-documents/cvm-gfi-284-using-relative-supersaturation-support-urinary-tract-health-claims-adult-maintenance-cat
FDA,Guidance,Endosseous Dental Implants and Endosseous Dental Implant Abutments - Performance Criteria for Safety and Performance Based Pathway:  Guidance for Industry and Food and Drug Administration Staff,Visit the link for more information,https://www.fda.gov/regulatory-information/search-fda-guidance-documents/endosseous-dental-implants-and-endosseous-dental-implant-abutments-performance-criteria-safety-and
FDA,Guidance,Temporary Policies for Compounding Certain Parenteral Drug Products:  Guidance for Industry,Visit the link for more information,https://www.fda.gov/regulatory-information/search-fda-guidance-documents/temporary-policies-compounding-certain-parenteral-drug-products
FDA,Guidance,"Electronic Systems, Electronic Records, and Electronic Signatures in Clinical Investigations:  Questions and Answers",Visit the link for more information,https://www.fda.gov/regulatory-information/search-fda-guidance-documents/electronic-systems-electronic-records-and-electronic-signatures-clinical-investigations-questions
