ASD Acronym,Designation,Title of Standard,Abstract,Link
FDA,Guidance,CVM GFI #263 Recommendations for Sponsors of Medically Important Antimicrobial Drugs Approved for Use in Animals to Voluntarily Bring Under Veterinary Oversight All Products That Continue to be Available Over-the-Counter,Visit the link for more information,https://www.fda.gov/regulatory-information/search-fda-guidance-documents/cvm-gfi-263-recommendations-sponsors-medically-important-antimicrobial-drugs-approved-use-animals
FDA,Guidance,Drug Supply Chain Security Act Implementation: Identification of Suspect Product and Notification Guidance for Industry,Visit the link for more information,https://www.fda.gov/regulatory-information/search-fda-guidance-documents/drug-supply-chain-security-act-implementation-identification-suspect-product-and-notification
FDA,Guidance,Product Identifiers under the Drug Supply Chain Security Act - Questions and Answers:  Guidance for Industry,Visit the link for more information,https://www.fda.gov/regulatory-information/search-fda-guidance-documents/product-identifiers-under-drug-supply-chain-security-act-questions-and-answers
FDA,Guidance,Oral Drug Products Administered Via Enteral Feeding Tube: In Vitro Testing and Labeling Recommendations: Draft Guidance for Industry,Visit the link for more information,https://www.fda.gov/regulatory-information/search-fda-guidance-documents/oral-drug-products-administered-enteral-feeding-tube-in-vitro-testing-and-labeling-recommendations
FDA,Guidance,CPG Sec 555.400 Aflatoxins in Human Food,Visit the link for more information,https://www.fda.gov/regulatory-information/search-fda-guidance-documents/cpg-sec-555400-aflatoxins-human-food
FDA,Guidance,CPG Sec 570.200 Aflatoxins in Brazil Nuts,Visit the link for more information,https://www.fda.gov/regulatory-information/search-fda-guidance-documents/cpg-sec-570200-aflatoxins-brazil-nuts
FDA,Guidance,CPG Sec 570.375 Aflatoxins in Peanuts and Peanut Products,Visit the link for more information,https://www.fda.gov/regulatory-information/search-fda-guidance-documents/cpg-sec-570375-aflatoxins-peanuts-and-peanut-products
FDA,Guidance,CPG Sec 570.500 Aflatoxins in Pistachio Nuts,Visit the link for more information,https://www.fda.gov/regulatory-information/search-fda-guidance-documents/cpg-sec-570500-aflatoxins-pistachio-nuts
FDA,Guidance,Bispecific Antibody Development Programs Guidance for Industry,Visit the link for more information,https://www.fda.gov/regulatory-information/search-fda-guidance-documents/bispecific-antibody-development-programs-guidance-industry
FDA,Guidance,FDARA Implementation Guidance for Pediatric Studies of Molecularly Targeted Oncology Drugs: Amendments to Sec. 505B of the FD&C Act:  Guidance for Industry,Visit the link for more information,https://www.fda.gov/regulatory-information/search-fda-guidance-documents/fdara-implementation-guidance-pediatric-studies-molecularly-targeted-oncology-drugs-amendments-sec
FDA,Guidance,ICH Q12: Implementation Considerations for FDA-Regulated Products: Draft Guidance for Industry,Visit the link for more information,https://www.fda.gov/regulatory-information/search-fda-guidance-documents/ich-q12-implementation-considerations-fda-regulated-products
FDA,Guidance,Implanted Brain-Computer Interface (BCI) Devices for Patients with Paralysis or Amputation - Non-clinical Testing and Clinical Considerations:  Guidance for Industry and Food and Drug Administration Staff,Visit the link for more information,https://www.fda.gov/regulatory-information/search-fda-guidance-documents/implanted-brain-computer-interface-bci-devices-patients-paralysis-or-amputation-non-clinical-testing
FDA,Guidance,Peripheral Vascular Atherectomy Devices - Premarket Notification [510(k)] Submissions:  Guidance for Industry and Food and Drug Administration Staff,Visit the link for more information,https://www.fda.gov/regulatory-information/search-fda-guidance-documents/peripheral-vascular-atherectomy-devices-premarket-notification-510k-submissions
FDA,Guidance,ANDAs for Certain Highly Purified Synthetic Peptide Drug Products That Refer to Listed Drugs of rDNA Origin Guidance for Industry:  Guidance for Industry,Visit the link for more information,https://www.fda.gov/regulatory-information/search-fda-guidance-documents/andas-certain-highly-purified-synthetic-peptide-drug-products-refer-listed-drugs-rdna-origin
FDA,Guidance,Chemotherapy-Induced Nausea and Vomiting: Developing Drugs for Prevention Guidance for Industry: Draft Guidance for Industry,Visit the link for more information,https://www.fda.gov/regulatory-information/search-fda-guidance-documents/chemotherapy-induced-nausea-and-vomiting-developing-drugs-prevention-guidance-industry
FDA,Guidance,"Information Sheet Guidance for Sponsors, Clinical Investigators, and IRBs  Frequently Asked Questions  Statement of Investigator  (Form FDA 1572) (Revision 1): Draft Information Sheet Guidance for Sponsors, Clinical Investigators, and IRBs  Frequently Asked Questions  Statement of Investigator  (Form FDA 1572) (Revision 1)",Visit the link for more information,https://www.fda.gov/regulatory-information/search-fda-guidance-documents/information-sheet-guidance-sponsors-clinical-investigators-and-irbs-frequently-asked-questions
FDA,Guidance,COVID-19: Master Protocols Evaluating Drugs and Biological Products for Treatment or Prevention:  Guidance for Industry,Visit the link for more information,https://www.fda.gov/regulatory-information/search-fda-guidance-documents/covid-19-master-protocols-evaluating-drugs-and-biological-products-treatment-or-prevention
FDA,Guidance,M9 Biopharmaceutics Classification System-Based Biowaivers,Visit the link for more information,https://www.fda.gov/regulatory-information/search-fda-guidance-documents/m9-biopharmaceutics-classification-system-based-biowaivers
FDA,Guidance,Q12 Technical and Regulatory Considerations for Pharmaceutical Product Lifecycle Management Annex,Visit the link for more information,https://www.fda.gov/regulatory-information/search-fda-guidance-documents/q12-technical-and-regulatory-considerations-pharmaceutical-product-lifecycle-management-annex
FDA,Guidance,E9(R1) Statistical Principles for Clinical Trials: Addendum: Estimands and Sensitivity Analysis in Clinical Trials:  Guidance for Industry,Visit the link for more information,https://www.fda.gov/regulatory-information/search-fda-guidance-documents/e9r1-statistical-principles-clinical-trials-addendum-estimands-and-sensitivity-analysis-clinical
FDA,Guidance,Q12 Technical and Regulatory Considerations for Pharmaceutical Product Lifecycle Management Guidance for Industry:  Guidance for Industry,Visit the link for more information,https://www.fda.gov/regulatory-information/search-fda-guidance-documents/q12-technical-and-regulatory-considerations-pharmaceutical-product-lifecycle-management-guidance
FDA,Guidance,S5(R3) Detection of Reproductive and Developmental Toxicity for Human Pharmaceuticals :  Guidance for Industry,Visit the link for more information,https://www.fda.gov/regulatory-information/search-fda-guidance-documents/s5r3-detection-reproductive-and-developmental-toxicity-human-pharmaceuticals
FDA,Guidance,Qualified Infectious Disease Product Designation Questions and Answers:  Guidance for Industy,Visit the link for more information,https://www.fda.gov/regulatory-information/search-fda-guidance-documents/qualified-infectious-disease-product-designation-questions-and-answers
FDA,Guidance,S11 Nonclinical Safety Testing In Support of Development of Pediatric Pharmaceuticals :  International Council for Harmonisation; Draft Guidance for Industry,Visit the link for more information,https://www.fda.gov/regulatory-information/search-fda-guidance-documents/s11-nonclinical-safety-testing-support-development-pediatric-pharmaceuticals
FDA,Guidance,Submitting Nonclinical Datasets for Evaluation of Rodent Carcinogenicity Studies of Pharmaceuticals,Visit the link for more information,https://www.fda.gov/regulatory-information/search-fda-guidance-documents/submitting-nonclinical-datasets-evaluation-rodent-carcinogenicity-studies-pharmaceuticals
FDA,Guidance,Nonclinical Testing of Individualized Antisense Oligonucleotide Drug Products for Severely Debilitating or Life-Threatening Diseases Guidance for Sponsor-Investigators: Draft Guidance for Sponsor-Investigators,Visit the link for more information,https://www.fda.gov/regulatory-information/search-fda-guidance-documents/nonclinical-testing-individualized-antisense-oligonucleotide-drug-products-severely-debilitating-or
FDA,Guidance,Guidance for Industry: Enforcement Policy for Providing an Acceptable Unique Facility Identifier (UFI) for the 2020 Food Facility Registration Biennial Renewal Period,Visit the link for more information,https://www.fda.gov/regulatory-information/search-fda-guidance-documents/guidance-industry-enforcement-policy-providing-acceptable-unique-facility-identifier-ufi-2020-food
FDA,Guidance,Manufacturing Considerations for Licensed and Investigational Cellular and Gene Therapy Products During COVID-19 Public Health Emergency:  Guidance for Industry,Visit the link for more information,https://www.fda.gov/regulatory-information/search-fda-guidance-documents/manufacturing-considerations-licensed-and-investigational-cellular-and-gene-therapy-products-during
FDA,Guidance,Safer Technologies Program for Medical Devices:  Guidance for Industry and Food and Drug Administration Staff,Visit the link for more information,https://www.fda.gov/regulatory-information/search-fda-guidance-documents/safer-technologies-program-medical-devices
FDA,Guidance,Mouse Embryo Assay for Assisted Reproduction Technology Devices,Visit the link for more information,https://www.fda.gov/regulatory-information/search-fda-guidance-documents/mouse-embryo-assay-assisted-reproduction-technology-devices
FDA,Guidance,IND Submissions for Individualized Antisense Oligonucleotide Drug Products: Administrative and Procedural Recommendations Guidance for Sponsor-Investigators: Draft Guidance for Sponsor-Investigators,Visit the link for more information,https://www.fda.gov/regulatory-information/search-fda-guidance-documents/ind-submissions-individualized-antisense-oligonucleotide-drug-products-administrative-and-procedural
FDA,Guidance,Consumer Antiseptic  Rub Final Rule Questions and Answers Guidance for Industry:  Guidance for Industry,Visit the link for more information,https://www.fda.gov/regulatory-information/search-fda-guidance-documents/consumer-antiseptic-rub-final-rule-questions-and-answers-guidance-industry
FDA,Guidance,Product Labeling for Laparoscopic Power Morcellators:  Guidance for Industry and Food and Drug Administration Staff,Visit the link for more information,https://www.fda.gov/regulatory-information/search-fda-guidance-documents/product-labeling-laparoscopic-power-morcellators
FDA,Guidance,Providing Regulatory Submissions in Electronic Format --Content of the Risk Evaluation and Mitigation Strategies Document Using Structured Product Labeling:  Guidance for Industry,Visit the link for more information,https://www.fda.gov/regulatory-information/search-fda-guidance-documents/providing-regulatory-submissions-electronic-format-content-risk-evaluation-and-mitigation-strategies
FDA,Guidance,Guidance for Industry: The Use of an Alternate Name for Potassium Chloride in Food Labeling,Visit the link for more information,https://www.fda.gov/regulatory-information/search-fda-guidance-documents/guidance-industry-use-alternate-name-potassium-chloride-food-labeling
FDA,Guidance,Bacterial Risk Control Strategies for Blood Collection Establishments and Transfusion Services to Enhance the Safety and Availability of Platelets for Transfusion:  Guidance for Industry,Visit the link for more information,https://www.fda.gov/regulatory-information/search-fda-guidance-documents/bacterial-risk-control-strategies-blood-collection-establishments-and-transfusion-services-enhance
FDA,Guidance,Dry Eye: Developing Drugs for Treatment Guidance for Industry,Visit the link for more information,https://www.fda.gov/regulatory-information/search-fda-guidance-documents/dry-eye-developing-drugs-treatment-guidance-industry
FDA,Guidance,Interacting with the FDA on Complex Innovative Trial Designs for Drugs and Biological Products:  Guidance for Industry,Visit the link for more information,https://www.fda.gov/regulatory-information/search-fda-guidance-documents/interacting-fda-complex-innovative-trial-designs-drugs-and-biological-products
FDA,Guidance,CVM GFI #262 Pre-Submission Consultation Process for Animal Food Additive Petitions or Generally Recognized as Safe (GRAS) Notices,Visit the link for more information,https://www.fda.gov/regulatory-information/search-fda-guidance-documents/cvm-gfi-262-pre-submission-consultation-process-animal-food-additive-petitions-or-generally
FDA,Guidance,Magnetic Resonance (MR) Receive-only Coil - Performance Criteria for Safety and Performance Based Pathway:  Guidance for Industry and Food and Drug Administration Staff,Visit the link for more information,https://www.fda.gov/regulatory-information/search-fda-guidance-documents/magnetic-resonance-mr-receive-only-coil-performance-criteria-safety-and-performance-based-pathway
FDA,Guidance,Spinal Plating Systems - Performance Criteria for Safety and Performance Based Pathway:  Guidance for Industry and Food and Drug Administration Staff,Visit the link for more information,https://www.fda.gov/regulatory-information/search-fda-guidance-documents/spinal-plating-systems-performance-criteria-safety-and-performance-based-pathway
FDA,Guidance,Best Practices in Developing Proprietary Names for Human Prescription Drug Products; Guidance for Industry:  Guidance for Industry,Visit the link for more information,https://www.fda.gov/regulatory-information/search-fda-guidance-documents/best-practices-developing-proprietary-names-human-prescription-drug-products-guidance-industry
FDA,Guidance,Best Practices in Developing Proprietary Names for Human Nonprescription Drug Products; Draft Guidance for Industry: Draft Guidance for Industry,Visit the link for more information,https://www.fda.gov/regulatory-information/search-fda-guidance-documents/best-practices-developing-proprietary-names-human-nonprescription-drug-products-draft-guidance
FDA,Guidance,Requesting FDA Feedback on Combination Products :  Guidance for Industry and FDA Staff,Visit the link for more information,https://www.fda.gov/regulatory-information/search-fda-guidance-documents/requesting-fda-feedback-combination-products
FDA,Guidance,"Recommendations for Screening, Testing, and Management of Blood Donors and Blood and Blood Components Based on Screening Tests for Syphilis:  Guidance for Industry",Visit the link for more information,https://www.fda.gov/regulatory-information/search-fda-guidance-documents/recommendations-screening-testing-and-management-blood-donors-and-blood-and-blood-components-based
FDA,Guidance,Compliance Policy Guide CPG Sec. 110.650 Weekly Entry Filing Guidance for Industry and FDA Staff,Visit the link for more information,https://www.fda.gov/regulatory-information/search-fda-guidance-documents/compliance-policy-guide-cpg-sec-110650-weekly-entry-filing-guidance-industry-and-fda-staff
FDA,Guidance,CVM GFI #242 In-Use Stability Studies and Associated Labeling Statements for Multiple-Dose Injectable Animal Drug Products,Visit the link for more information,https://www.fda.gov/regulatory-information/search-fda-guidance-documents/cvm-gfi-242-use-stability-studies-and-associated-labeling-statements-multiple-dose-injectable-animal
FDA,Guidance,Qualification Process for Drug Development Tools Guidance for Industry and FDA Staff,Visit the link for more information,https://www.fda.gov/regulatory-information/search-fda-guidance-documents/qualification-process-drug-development-tools-guidance-industry-and-fda-staff
FDA,Guidance,CVM GFI #255 Elemental Impurities in Animal Drug Products Questions and Answers,Visit the link for more information,https://www.fda.gov/regulatory-information/search-fda-guidance-documents/cvm-gfi-255-elemental-impurities-animal-drug-products-questions-and-answers
FDA,Guidance,Public Availability of Lists of Retail Consignees to Effectuate Certain Human and Animal Food Recalls:  Guidance for Industry and FDA Staff,Visit the link for more information,https://www.fda.gov/regulatory-information/search-fda-guidance-documents/public-availability-lists-retail-consignees-effectuate-certain-human-and-animal-food-recalls
FDA,Guidance,CVM GFI #197 Documenting Electronic Data Files and Statistical Analysis Programs,Visit the link for more information,https://www.fda.gov/regulatory-information/search-fda-guidance-documents/cvm-gfi-197-documenting-electronic-data-files-and-statistical-analysis-programs
FDA,Guidance,"Certificates of Confidentiality:  Guidance for Sponsors, Sponsor-Investigators, Researchers, Industry, and Food and Drug Administration Staff",Visit the link for more information,https://www.fda.gov/regulatory-information/search-fda-guidance-documents/certificates-confidentiality
FDA,Guidance,Draft Guidance for Industry: Voluntary Disclosure of Sesame as an Allergen,Visit the link for more information,https://www.fda.gov/regulatory-information/search-fda-guidance-documents/draft-guidance-industry-voluntary-disclosure-sesame-allergen
FDA,Guidance,Regulatory Considerations for Microneedling Products:  Guidance for Industry and Food and Drug Administration Staff,Visit the link for more information,https://www.fda.gov/regulatory-information/search-fda-guidance-documents/regulatory-considerations-microneedling-products
FDA,Guidance,Assessing User Fees Under the Prescription Drug User Fee Amendments of 2017 Guidance for Industry:  Guidance for Industry,Visit the link for more information,https://www.fda.gov/regulatory-information/search-fda-guidance-documents/assessing-user-fees-under-prescription-drug-user-fee-amendments-2017-guidance-industry
FDA,Guidance,Insanitary Conditions at Compounding Facilities Guidance for Industry,Visit the link for more information,https://www.fda.gov/regulatory-information/search-fda-guidance-documents/insanitary-conditions-compounding-facilities-guidance-industry
FDA,Guidance,Guidance for Industry: Prior Notice of Imported Food Contingency Plan for System Outages,Visit the link for more information,https://www.fda.gov/regulatory-information/search-fda-guidance-documents/guidance-industry-prior-notice-imported-food-contingency-plan-system-outages
FDA,Guidance,Nonclinical Testing of Orally Inhaled Nicotine-Containing Drug Products Guidance for Industry,Visit the link for more information,https://www.fda.gov/regulatory-information/search-fda-guidance-documents/nonclinical-testing-orally-inhaled-nicotine-containing-drug-products-guidance-industry
FDA,Guidance,Referencing Approved Drug Products in ANDA Submissions Guidance for Industry,Visit the link for more information,https://www.fda.gov/regulatory-information/search-fda-guidance-documents/referencing-approved-drug-products-anda-submissions-guidance-industry
FDA,Guidance,Wholesale Distributor Verification Requirement for Saleable Returned Drug Product and Dispenser Verification Requirements When Investigating a Suspect or Illegitimate Product—Compliance Policies,Visit the link for more information,https://www.fda.gov/regulatory-information/search-fda-guidance-documents/wholesale-distributor-verification-requirement-saleable-returned-drug-product-and-dispenser
FDA,Guidance,Guidance for Industry: The Declaration of Allulose and Calories from Allulose on Nutrition and Supplement Facts Labels,Visit the link for more information,https://www.fda.gov/regulatory-information/search-fda-guidance-documents/guidance-industry-declaration-allulose-and-calories-allulose-nutrition-and-supplement-facts-labels
FDA,Guidance,Guidance for Industry: U.S. Agent Voluntary Identification System (VIS) for Food Facility Registration,Visit the link for more information,https://www.fda.gov/regulatory-information/search-fda-guidance-documents/guidance-industry-us-agent-voluntary-identification-system-vis-food-facility-registration
FDA,Guidance,Testing for Biotin Interference in In Vitro Diagnostic Devices:  Guidance for Industry,Visit the link for more information,https://www.fda.gov/regulatory-information/search-fda-guidance-documents/testing-biotin-interference-in-vitro-diagnostic-devices
FDA,Guidance,Opioid Use Disorder: Endpoints for Demonstrating Effectiveness of Drugs for Treatment Guidance for Industry,Visit the link for more information,https://www.fda.gov/regulatory-information/search-fda-guidance-documents/opioid-use-disorder-endpoints-demonstrating-effectiveness-drugs-treatment-guidance-industry
FDA,Guidance,"Importation of Certain FDA- Approved Human Prescription Drugs, Including Biological Products, and Combination Products under Section 801(d)(1)(B) of the Federal Food, Drug, and Cosmetic Act:  Guidance for Industry",Visit the link for more information,https://www.fda.gov/regulatory-information/search-fda-guidance-documents/importation-certain-fda-approved-human-prescription-drugs-including-biological-products-and
FDA,Guidance,"The Use of Physiologically Based Pharmacokinetic Analyses — Biopharmaceutics Applications for Oral Drug Product Development, Manufacturing Changes, and Controls : Draft Guidance for Industry",Visit the link for more information,https://www.fda.gov/regulatory-information/search-fda-guidance-documents/use-physiologically-based-pharmacokinetic-analyses-biopharmaceutics-applications-oral-drug-product
FDA,Guidance,"Saline, Silicone Gel, and Alternative Breast Implants:  Guidance for Industry and FDA Staff",Visit the link for more information,https://www.fda.gov/regulatory-information/search-fda-guidance-documents/saline-silicone-gel-and-alternative-breast-implants
FDA,Guidance,Blood Glucose Monitoring Test Systems for Prescription Point-of-Care Use:  Guidance for Industry and Food and Drug Administration Staff,Visit the link for more information,https://www.fda.gov/regulatory-information/search-fda-guidance-documents/blood-glucose-monitoring-test-systems-prescription-point-care-use
FDA,Guidance,Breast Implants - Certain Labeling Recommendations to Improve Patient Communication:  Guidance for Industry and Food and Drug Administration Staff,Visit the link for more information,https://www.fda.gov/regulatory-information/search-fda-guidance-documents/breast-implants-certain-labeling-recommendations-improve-patient-communication
FDA,Guidance,Self-Monitoring Blood Glucose Test Systems for Over-the-Counter Use:  Guidance for Industry and Food and Drug Administration Staff,Visit the link for more information,https://www.fda.gov/regulatory-information/search-fda-guidance-documents/self-monitoring-blood-glucose-test-systems-over-counter-use
FDA,Guidance,"Basic Safety and Essential Performance of Medical Electrical Equipment, Medical Electrical Systems, and Laboratory Medical Equipment - Standards Specific Information for the Accreditation Scheme for Conformity Assessment (ASCA) Pilot Program:  Guidance for Industry, Accreditation Bodies, Testing Laboratories, and Food and Drug Administration Staff",Visit the link for more information,https://www.fda.gov/regulatory-information/search-fda-guidance-documents/basic-safety-and-essential-performance-medical-electrical-equipment-medical-electrical-systems-and
FDA,Guidance,"Biocompatibility Testing of Medical Devices - Standards Specific Information for the Accreditation Scheme for Conformity Assessment (ASCA) Pilot Program:  Guidance for Industry, Accreditation Bodies, Testing Laboratories, and Food and Drug Administration Staff",Visit the link for more information,https://www.fda.gov/regulatory-information/search-fda-guidance-documents/biocompatibility-testing-medical-devices-standards-specific-information-accreditation-scheme
FDA,Guidance,"The Accreditation Scheme for Conformity Assessment (ASCA) Pilot Program:  Guidance for Industry, Accreditation Bodies, Testing Laboratories, and Food and Drug Administration Staff",Visit the link for more information,https://www.fda.gov/regulatory-information/search-fda-guidance-documents/accreditation-scheme-conformity-assessment-asca-pilot-program
FDA,Guidance,Eosinophilic Esophagitis: Developing Drugs for Treatment Guidance for Industry,Visit the link for more information,https://www.fda.gov/regulatory-information/search-fda-guidance-documents/eosinophilic-esophagitis-developing-drugs-treatment-guidance-industry
FDA,Guidance,Geriatric Information in Human Prescription Drug and Biological Product Labeling Guidance for Industry: Draft Guidance for Industry,Visit the link for more information,https://www.fda.gov/regulatory-information/search-fda-guidance-documents/geriatric-information-human-prescription-drug-and-biological-product-labeling-guidance-industry
FDA,Guidance,Recognition and Withdrawal of Voluntary Consensus Standards:  Guidance for Industry and Food and Drug Administration Staff,Visit the link for more information,https://www.fda.gov/regulatory-information/search-fda-guidance-documents/recognition-and-withdrawal-voluntary-consensus-standards
FDA,Guidance,CVM GFI #191 Changes to Approved NADAs - New NADAs vs. Category II Supplemental NADAs,Visit the link for more information,https://www.fda.gov/regulatory-information/search-fda-guidance-documents/cvm-gfi-191-changes-approved-nadas-new-nadas-vs-category-ii-supplemental-nadas
FDA,Guidance,Acute Myeloid Leukemia:  Developing Drugs and Biological Products for Treatment: Draft Guidance for Industry,Visit the link for more information,https://www.fda.gov/regulatory-information/search-fda-guidance-documents/acute-myeloid-leukemia-developing-drugs-and-biological-products-treatment
