ASD Acronym,Designation,Title of Standard,Abstract,Link
FDA,Guidance,Guidance for Industry: Standardized Training Curriculum for Application of HACCP Principles to Juice Processing,Visit the link for more information,https://www.fda.gov/regulatory-information/search-fda-guidance-documents/guidance-industry-standardized-training-curriculum-application-haccp-principles-juice-processing
FDA,Guidance,"Drug Products Containing Ensulizole, Hypromellose, Meradimate, Octinoxate, and Octisalate — Labeling Enforcement Policy",Visit the link for more information,https://www.fda.gov/regulatory-information/search-fda-guidance-documents/drug-products-containing-ensulizole-hypromellose-meradimate-octinoxate-and-octisalate-labeling
FDA,Guidance,Pediatric Expertise for Advisory Panels - Guidance for Industry and FDA Staff,Visit the link for more information,https://www.fda.gov/regulatory-information/search-fda-guidance-documents/pediatric-expertise-advisory-panels-guidance-industry-and-fda-staff
FDA,Guidance,"Pharmacokinetics in Patients with Impaired Hepatic Function: Study Design, Data Analysis, and Impact on Dosing and Labeling",Visit the link for more information,https://www.fda.gov/regulatory-information/search-fda-guidance-documents/pharmacokinetics-patients-impaired-hepatic-function-study-design-data-analysis-and-impact-dosing-and
FDA,Guidance,"INDs for Phase 2 and Phase 3 Studies Chemistry, Manufacturing, and Controls Information:  Guidance for Industry",Visit the link for more information,https://www.fda.gov/regulatory-information/search-fda-guidance-documents/inds-phase-2-and-phase-3-studies-chemistry-manufacturing-and-controls-information
FDA,Guidance,"Exposure-Response Relationships — Study Design, Data Analysis, and Regulatory Applications",Visit the link for more information,https://www.fda.gov/regulatory-information/search-fda-guidance-documents/exposure-response-relationships-study-design-data-analysis-and-regulatory-applications
FDA,Guidance,CVM GFI #118 Mass Spectrometry for Confirmation of Identity of Animal Drug Residues,Visit the link for more information,https://www.fda.gov/regulatory-information/search-fda-guidance-documents/cvm-gfi-118-mass-spectrometry-confirmation-identity-animal-drug-residues
FDA,Guidance,Guidance for Industry: Bulk Transport of Juice Concentrates and Certain Shelf-Stable Juices,Visit the link for more information,https://www.fda.gov/regulatory-information/search-fda-guidance-documents/guidance-industry-bulk-transport-juice-concentrates-and-certain-shelf-stable-juices
FDA,Guidance,Guidance for Industry: Recommendations for the Assessment of Donor Suitability and Blood Product Safety in Cases of Suspected Severe Acute Respiratory Syndrome (SARS) or Exposure to SARS,Visit the link for more information,https://www.fda.gov/regulatory-information/search-fda-guidance-documents/guidance-industry-recommendations-assessment-donor-suitability-and-blood-product-safety-cases
FDA,Guidance,"Statistical Information from the June 1999 Draft Guidance and Statistical Information for In Vitro Bioequivalence Data Posted on August 18, 1999",Visit the link for more information,https://www.fda.gov/regulatory-information/search-fda-guidance-documents/statistical-information-june-1999-draft-guidance-and-statistical-information-in-vitro-bioequivalence
FDA,Guidance,Small Entity Compliance Guide: Juice HACCP,Visit the link for more information,https://www.fda.gov/regulatory-information/search-fda-guidance-documents/small-entity-compliance-guide-juice-haccp
FDA,Guidance,Bioavailability and Bioequivalence Studies for Nasal Aerosols and Nasal Sprays for Local Action,Visit the link for more information,https://www.fda.gov/regulatory-information/search-fda-guidance-documents/bioavailability-and-bioequivalence-studies-nasal-aerosols-and-nasal-sprays-local-action
FDA,Guidance,User Labeling for Devices that Contain Natural Rubber (21 CFR 801.437); Small Entity Compliance Guide - Guidance for Industry,Visit the link for more information,https://www.fda.gov/regulatory-information/search-fda-guidance-documents/user-labeling-devices-contain-natural-rubber-21-cfr-801437-small-entity-compliance-guide-guidance
FDA,Guidance,Integration of Dose-Counting Mechanisms into MDI Drug Products,Visit the link for more information,https://www.fda.gov/regulatory-information/search-fda-guidance-documents/integration-dose-counting-mechanisms-mdi-drug-products
FDA,Guidance,M4: The CTD -- Safety Questions and Answers,Visit the link for more information,https://www.fda.gov/regulatory-information/search-fda-guidance-documents/m4-ctd-safety-questions-and-answers
FDA,Guidance,Prussian Blue Drug Products — Submitting a New Drug Application,Visit the link for more information,https://www.fda.gov/regulatory-information/search-fda-guidance-documents/prussian-blue-drug-products-submitting-new-drug-application
FDA,Guidance,Quality System Information for Certain Premarket Application Reviews :  Guidance for Industry and FDA Staff,Visit the link for more information,https://www.fda.gov/regulatory-information/search-fda-guidance-documents/quality-system-information-certain-premarket-application-reviews
FDA,Guidance,Estrogen and Estrogen/Progestin Drug Products to Treat Vasomotor Symptoms and Vulvar and Vaginal Atrophy Symptoms — Recommendations for Clinical Evaluation,Visit the link for more information,https://www.fda.gov/regulatory-information/search-fda-guidance-documents/estrogen-and-estrogenprogestin-drug-products-treat-vasomotor-symptoms-and-vulvar-and-vaginal-atrophy
FDA,Guidance,Q1D Bracketing and Matrixing Designs for Stability Testing of New Drug Substances and Products,Visit the link for more information,https://www.fda.gov/regulatory-information/search-fda-guidance-documents/q1d-bracketing-and-matrixing-designs-stability-testing-new-drug-substances-and-products
FDA,Guidance,Recommendations for Deferral of Donors and Quarantine and Retrieval of Blood and Blood Products in Recent Recipients of Smallpox Vaccine (Vaccinia Virus) and Certain Contacts of Smallpox Vaccine Recipients:  Guidance for Industry,Visit the link for more information,https://www.fda.gov/regulatory-information/search-fda-guidance-documents/recommendations-deferral-donors-and-quarantine-and-retrieval-blood-and-blood-products-recent
FDA,Guidance,(Potassium Iodide) KI in Radiation Emergencies-Questions and Answers,Visit the link for more information,https://www.fda.gov/regulatory-information/search-fda-guidance-documents/potassium-iodide-ki-radiation-emergencies-questions-and-answers
FDA,Guidance,"Guidance for Industry: Implementation of Section 403(t) of the Federal Food, Drug, and Cosmetic Act (21 U.S.C. 343(t)) Regarding the Use of the Term ""Catfish""",Visit the link for more information,https://www.fda.gov/regulatory-information/search-fda-guidance-documents/guidance-industry-implementation-section-403t-federal-food-drug-and-cosmetic-act-21-usc-343t
FDA,Guidance,Determination of Intended Use for 510(k) Devices - Guidance for CDRH Staff (Update to K98-1),Visit the link for more information,https://www.fda.gov/regulatory-information/search-fda-guidance-documents/determination-intended-use-510k-devices-guidance-cdrh-staff-update-k98-1
FDA,Guidance,Food-Effect Bioavailability and Fed Bioequivalence Studies:  Guidance for Industry,Visit the link for more information,https://www.fda.gov/regulatory-information/search-fda-guidance-documents/food-effect-bioavailability-and-fed-bioequivalence-studies
FDA,Guidance,CVM GFI #80 Evaluation the Utility of Anti-Salmonella Chemical Food Additives,Visit the link for more information,https://www.fda.gov/regulatory-information/search-fda-guidance-documents/cvm-gfi-80-evaluation-utility-anti-salmonella-chemical-food-additives
FDA,Guidance,"CPG Sec 555.600 Filth from Insects, Rodents, and Other Pests in Foods",Visit the link for more information,https://www.fda.gov/regulatory-information/search-fda-guidance-documents/cpg-sec-555600-filth-insects-rodents-and-other-pests-foods
FDA,Guidance,"Needlesticks -  Medical Device Reporting Guidance for User Facilities, Manufacturers, and Importers",Visit the link for more information,https://www.fda.gov/regulatory-information/search-fda-guidance-documents/needlesticks-medical-device-reporting-guidance-user-facilities-manufacturers-and-importers
FDA,Guidance,Draft Guidance for Industry: Regulatory Procedures Manual Chapter 9 Subchapter on Recommending Customs' Seizure and Destruction of Imported Human and Animal Food That Has Not Been Reconditioned,Visit the link for more information,https://www.fda.gov/regulatory-information/search-fda-guidance-documents/draft-guidance-industry-regulatory-procedures-manual-chapter-9-subchapter-recommending-customs
FDA,Guidance,CVM GFI #82 Development of Supplemental Applications for Approved New Animal Drugs,Visit the link for more information,https://www.fda.gov/regulatory-information/search-fda-guidance-documents/cvm-gfi-82-development-supplemental-applications-approved-new-animal-drugs
FDA,Guidance,Guidance for Small Businesses: Submission of Comments for CFSAN Rulemaking,Visit the link for more information,https://www.fda.gov/regulatory-information/search-fda-guidance-documents/guidance-small-businesses-submission-comments-cfsan-rulemaking
FDA,Guidance,Labeling OTC Human Drug Products Updating Labeling in RLDs and ANDAs,Visit the link for more information,https://www.fda.gov/regulatory-information/search-fda-guidance-documents/labeling-otc-human-drug-products-updating-labeling-rlds-and-andas
FDA,Guidance,Guidance for Industry:  Implementation of Section 10809 of the Farm Security and Investment Act of 2002 Regarding the Petition Process to Request Approval of Labeling for Foods that Have Been Treated with Irradiation,Visit the link for more information,https://www.fda.gov/regulatory-information/search-fda-guidance-documents/guidance-industry-implementation-section-10809-farm-security-and-investment-act-2002-regarding
FDA,Guidance,Guidance for Industry: Exemptions from the Warning Label Requirement for Juice,Visit the link for more information,https://www.fda.gov/regulatory-information/search-fda-guidance-documents/guidance-industry-exemptions-warning-label-requirement-juice
FDA,Guidance,CVM GFI #119 How CVM Intends to Handle Deficient Submissions Filed During the Investigation of a New Animal Drug,Visit the link for more information,https://www.fda.gov/regulatory-information/search-fda-guidance-documents/cvm-gfi-119-how-cvm-intends-handle-deficient-submissions-filed-during-investigation-new-animal-drug
FDA,Guidance,Guidance on the Department of Defense Exemption from the FDA Performance Standard for Laser Products:  Guidance for Industry and FDA,Visit the link for more information,https://www.fda.gov/regulatory-information/search-fda-guidance-documents/guidance-department-defense-exemption-fda-performance-standard-laser-products
FDA,Guidance,"Nasal Spray and Inhalation Solution, Suspension, and Spray Drug Products--Chemistry, Manufacturing, and Controls Documentation:  Guidance for Industry",Visit the link for more information,https://www.fda.gov/regulatory-information/search-fda-guidance-documents/nasal-spray-and-inhalation-solution-suspension-and-spray-drug-products-chemistry-manufacturing-and
FDA,Guidance,Guidance for Resorbable Adhesion Barrier Devices for Use in Abdominal and/or Pelvic Surgery - Guidance for Industry,Visit the link for more information,https://www.fda.gov/regulatory-information/search-fda-guidance-documents/guidance-resorbable-adhesion-barrier-devices-use-abdominal-andor-pelvic-surgery-guidance-industry
FDA,Guidance,Guidance for Industry: Channels of Trade Policy for Commodities with Vinclozolin Residues,Visit the link for more information,https://www.fda.gov/regulatory-information/search-fda-guidance-documents/guidance-industry-channels-trade-policy-commodities-vinclozolin-residues
FDA,Guidance,Carcinogenicity Study Protocol Submissions,Visit the link for more information,https://www.fda.gov/regulatory-information/search-fda-guidance-documents/carcinogenicity-study-protocol-submissions
FDA,Guidance,Container Closure Systems for Packaging Human Drugs and Biologics -- Questions and Answers:  Guidance for Industry,Visit the link for more information,https://www.fda.gov/regulatory-information/search-fda-guidance-documents/container-closure-systems-packaging-human-drugs-and-biologics-questions-and-answers
FDA,Guidance,E2BM Data Elements for Transmission Of Individual Case Safety Reports,Visit the link for more information,https://www.fda.gov/regulatory-information/search-fda-guidance-documents/e2bm-data-elements-transmission-individual-case-safety-reports
FDA,Guidance,Validation of Procedures for Processing of Human Tissues Intended for Transplantation:  Guidance for Industry,Visit the link for more information,https://www.fda.gov/regulatory-information/search-fda-guidance-documents/validation-procedures-processing-human-tissues-intended-transplantation
FDA,Guidance,Guidance for Industry: Providing Regulatory Submissions to CBER in Electronic Format -- Investigational New Drug Applications (INDs) (PDF),Visit the link for more information,https://www.fda.gov/regulatory-information/search-fda-guidance-documents/guidance-industry-providing-regulatory-submissions-cber-electronic-format-investigational-new-drug
FDA,Guidance,General Principles of Software Validation:  Guidance for Industry and FDA Staff,Visit the link for more information,https://www.fda.gov/regulatory-information/search-fda-guidance-documents/general-principles-software-validation
FDA,Guidance,Small Entity Compliance Guide on Structure/Function Claims,Visit the link for more information,https://www.fda.gov/regulatory-information/search-fda-guidance-documents/small-entity-compliance-guide-structurefunction-claims
FDA,Guidance,Sterilized Convenience Kits for Clinical and Surgical Use:  Final Guidance for Industry,Visit the link for more information,https://www.fda.gov/regulatory-information/search-fda-guidance-documents/sterilized-convenience-kits-clinical-and-surgical-use
FDA,Guidance,Potassium Iodide as a Thyroid Blocking Agent in Radiation Emergencies,Visit the link for more information,https://www.fda.gov/regulatory-information/search-fda-guidance-documents/potassium-iodide-thyroid-blocking-agent-radiation-emergencies
FDA,Guidance,CVM GFI #142 (VICH GL29) Pharmacovigilance of Veterinary Medicinal Products: Management of Periodic Summary Update Reports (PSUs),Visit the link for more information,https://www.fda.gov/regulatory-information/search-fda-guidance-documents/cvm-gfi-142-vich-gl29-pharmacovigilance-veterinary-medicinal-products-management-periodic-summary
FDA,Guidance,Information Request and Discipline Review Letters Under the Prescription Drug User Fee Act:  Guidance for Industry,Visit the link for more information,https://www.fda.gov/regulatory-information/search-fda-guidance-documents/information-request-and-discipline-review-letters-under-prescription-drug-user-fee-act
FDA,Guidance,Guidance for Industry: Fumonisin Levels in Human Foods and Animal Feeds,Visit the link for more information,https://www.fda.gov/regulatory-information/search-fda-guidance-documents/guidance-industry-fumonisin-levels-human-foods-and-animal-feeds
FDA,Guidance,Sterility Requirement for Aqueous-Based Drug Products for Oral Inhalation — Small Entity Compliance Guide:  Guidance for Industry,Visit the link for more information,https://www.fda.gov/regulatory-information/search-fda-guidance-documents/sterility-requirement-aqueous-based-drug-products-oral-inhalation-small-entity-compliance-guide
FDA,Guidance,Recommendations for Assessment of Donor Suitability and Blood and Blood Product Safety in Cases of Possible Exposure to Anthrax:  Guidance for Industry,Visit the link for more information,https://www.fda.gov/regulatory-information/search-fda-guidance-documents/recommendations-assessment-donor-suitability-and-blood-and-blood-product-safety-cases-possible
FDA,Guidance,Cancer Drug and Biological Products - Clinical Data in Marketing Applications,Visit the link for more information,https://www.fda.gov/regulatory-information/search-fda-guidance-documents/cancer-drug-and-biological-products-clinical-data-marketing-applications
FDA,Guidance,Redbook 2000: VI.B Epidemiology,Visit the link for more information,https://www.fda.gov/regulatory-information/search-fda-guidance-documents/redbook-2000-vib-epidemiology
FDA,Guidance,Submitting Marketing Applications According to the ICH/CTD Format: General Considerations 2001,Visit the link for more information,https://www.fda.gov/regulatory-information/search-fda-guidance-documents/submitting-marketing-applications-according-ichctd-format-general-considerations-2001
FDA,Guidance,Submitting Marketing Applications According to the ICH/CTD Format: General Considerations,Visit the link for more information,https://www.fda.gov/regulatory-information/search-fda-guidance-documents/submitting-marketing-applications-according-ichctd-format-general-considerations
FDA,Guidance,Guidance for Industry: Questions and Answers on Juice HACCP Regulation,Visit the link for more information,https://www.fda.gov/regulatory-information/search-fda-guidance-documents/guidance-industry-questions-and-answers-juice-haccp-regulation
FDA,Guidance,Q7A Good Manufacturing Practice Guidance for Active Pharmaceutical Ingredients,Visit the link for more information,https://www.fda.gov/regulatory-information/search-fda-guidance-documents/q7a-good-manufacturing-practice-guidance-active-pharmaceutical-ingredients
FDA,Guidance,M4: The CTD -- Quality,Visit the link for more information,https://www.fda.gov/regulatory-information/search-fda-guidance-documents/m4-ctd-quality
FDA,Guidance,M4S: The CTD -- Safety,Visit the link for more information,https://www.fda.gov/regulatory-information/search-fda-guidance-documents/m4s-ctd-safety
FDA,Guidance,M4S: The CTD -- Safety Appendices,Visit the link for more information,https://www.fda.gov/regulatory-information/search-fda-guidance-documents/m4s-ctd-safety-appendices
FDA,Guidance,Labeling Recommendations for Single-Use Devices Reprocessed by Third Parties and Hospitals:  Final Guidance for Industry and FDA,Visit the link for more information,https://www.fda.gov/regulatory-information/search-fda-guidance-documents/labeling-recommendations-single-use-devices-reprocessed-third-parties-and-hospitals
FDA,Guidance,Premarket Notification Submissions for Empty Containers for the Collection and Processing of Blood and Blood Components:  Guidance for FDA Reviewers,Visit the link for more information,https://www.fda.gov/regulatory-information/search-fda-guidance-documents/premarket-notification-submissions-empty-containers-collection-and-processing-blood-and-blood
FDA,Guidance,Premarket Notification Submissions for Blood and Plasma Warmers:  Guidance for FDA Reviewers,Visit the link for more information,https://www.fda.gov/regulatory-information/search-fda-guidance-documents/premarket-notification-submissions-blood-and-plasma-warmers
FDA,Guidance,Premarket Notification Submissions for Transfer Sets (Excluding Sterile Connecting Devices):  Guidance for FDA Reviewers,Visit the link for more information,https://www.fda.gov/regulatory-information/search-fda-guidance-documents/premarket-notification-submissions-transfer-sets-excluding-sterile-connecting-devices
FDA,Guidance,"Levothyroxine Sodium Products Enforcement of August 14, 2001 Compliance Date and Submission of New Applications",Visit the link for more information,https://www.fda.gov/regulatory-information/search-fda-guidance-documents/levothyroxine-sodium-products-enforcement-august-14-2001-compliance-date-and-submission-new
FDA,Guidance,S7A Safety Pharmacology Studies for Human Pharmaceuticals,Visit the link for more information,https://www.fda.gov/regulatory-information/search-fda-guidance-documents/s7a-safety-pharmacology-studies-human-pharmaceuticals
FDA,Guidance,Revised Recommendations Regarding Invalidation of Test Results of Licensed and 510(k) Cleared Bloodborne Pathogen Assays Used to Test Donors:  Guidance for Industry,Visit the link for more information,https://www.fda.gov/regulatory-information/search-fda-guidance-documents/revised-recommendations-regarding-invalidation-test-results-licensed-and-510k-cleared-bloodborne
FDA,Guidance,CVM GFI #104 Content and Format of Effectiveness and Target Animal Safety Technical Sections and Final Study Reports For Submission,Visit the link for more information,https://www.fda.gov/regulatory-information/search-fda-guidance-documents/cvm-gfi-104-content-and-format-effectiveness-and-target-animal-safety-technical-sections-and-final
FDA,Guidance,CVM GFI #56 Protocol Development Guideline for Clinical Effectiveness and Target Animal Safety Trials,Visit the link for more information,https://www.fda.gov/regulatory-information/search-fda-guidance-documents/cvm-gfi-56-protocol-development-guideline-clinical-effectiveness-and-target-animal-safety-trials
FDA,Guidance,Frequently-Asked-Questions about the Reprocessing and Reuse of Single-Use Devices by Third-Party and Hospital Reprocessors:  Final Guidance for Industry and FDA Staff,Visit the link for more information,https://www.fda.gov/regulatory-information/search-fda-guidance-documents/frequently-asked-questions-about-reprocessing-and-reuse-single-use-devices-third-party-and-hospital
FDA,Guidance,Guidance for Industry: Refusal of Inspection or Access to HACCP Records Pertaining to the Safe and Sanitary Processing of Fish and Fishery Products,Visit the link for more information,https://www.fda.gov/regulatory-information/search-fda-guidance-documents/guidance-industry-refusal-inspection-or-access-haccp-records-pertaining-safe-and-sanitary-processing
FDA,Guidance,Small Entity Compliance Guide: Safe Handling Statements on Labeling of Shell Eggs and the Refrigeration of Shell Eggs Held for Retail Distribution,Visit the link for more information,https://www.fda.gov/regulatory-information/search-fda-guidance-documents/small-entity-compliance-guide-safe-handling-statements-labeling-shell-eggs-and-refrigeration-shell
FDA,Guidance,"Small Entity Compliance Guide: Serving Sizes Reference Amount for Baking Powder, Baking Soda, and Pectin",Visit the link for more information,https://www.fda.gov/regulatory-information/search-fda-guidance-documents/small-entity-compliance-guide-serving-sizes-reference-amount-baking-powder-baking-soda-and-pectin
FDA,Guidance,Information for Keratome Manufacturers Regarding LASIK - Final Guidance for Industry,Visit the link for more information,https://www.fda.gov/regulatory-information/search-fda-guidance-documents/information-keratome-manufacturers-regarding-lasik-final-guidance-industry
FDA,Guidance,Changes or Modifications During the Conduct of a Clinical Investigation; Final Guidance for Industry and CDRH Staff,Visit the link for more information,https://www.fda.gov/regulatory-information/search-fda-guidance-documents/changes-or-modifications-during-conduct-clinical-investigation-final-guidance-industry-and-cdrh
FDA,Guidance,"Responsibilities of Laser Light Show Projector Manufacturers, Dealers, and Distributors; (Laser Notice 51)",Visit the link for more information,https://www.fda.gov/regulatory-information/search-fda-guidance-documents/responsibilities-laser-light-show-projector-manufacturers-dealers-and-distributors-laser-notice-51
FDA,Guidance,E10 Choice of Control Group and Related Issues in Clinical Trials,Visit the link for more information,https://www.fda.gov/regulatory-information/search-fda-guidance-documents/e10-choice-control-group-and-related-issues-clinical-trials
FDA,Guidance,CVM GFI #85 (VICH GL9) Good Clinical Practice,Visit the link for more information,https://www.fda.gov/regulatory-information/search-fda-guidance-documents/cvm-gfi-85-vich-gl9-good-clinical-practice
FDA,Guidance,"Statistical Aspects of the Design, Analysis, and Interpretation of Chronic Rodent Carcinogenicity Studies of Pharmaceuticals",Visit the link for more information,https://www.fda.gov/regulatory-information/search-fda-guidance-documents/statistical-aspects-design-analysis-and-interpretation-chronic-rodent-carcinogenicity-studies
FDA,Guidance,"IND Meetings for Human Drugs and Biologics Chemistry, Manufacturing, and Controls Information:  Guidance for Industry",Visit the link for more information,https://www.fda.gov/regulatory-information/search-fda-guidance-documents/ind-meetings-human-drugs-and-biologics-chemistry-manufacturing-and-controls-information
FDA,Guidance,Guidance on Medical Device Patient Labeling:  Final Guidance for Industry and FDA Staff,Visit the link for more information,https://www.fda.gov/regulatory-information/search-fda-guidance-documents/guidance-medical-device-patient-labeling
FDA,Guidance,"Guidance for Hospitals, Nursing Homes, and Other Health Care Facilities - FDA Public Health Advisory:  Guidance for Hospitals, Nursing Homes, and Other Health Care Facilities",Visit the link for more information,https://www.fda.gov/regulatory-information/search-fda-guidance-documents/guidance-hospitals-nursing-homes-and-other-health-care-facilities-fda-public-health-advisory
FDA,Guidance,CVM GFI #99 (VICH GL17) Testing of New Biotechnological/Biological Products,Visit the link for more information,https://www.fda.gov/regulatory-information/search-fda-guidance-documents/cvm-gfi-99-vich-gl17-testing-new-biotechnologicalbiological-products
FDA,Guidance,Postmarketing Safety Reporting for Human Drug and Biological Products Including Vaccines: Draft Guidance for Industry,Visit the link for more information,https://www.fda.gov/regulatory-information/search-fda-guidance-documents/postmarketing-safety-reporting-human-drug-and-biological-products-including-vaccines
