ASD Acronym,Designation,Title of Standard,Abstract,Link
FDA,Guidance,Small Entity Compliance Guide: Nutrition Labeling of Standard Menu Items in Restaurants and Similar Retail Food Establishments,Visit the link for more information,https://www.fda.gov/regulatory-information/search-fda-guidance-documents/small-entity-compliance-guide-nutrition-labeling-standard-menu-items-restaurants-and-similar-retail
FDA,Guidance,CVM GFI #207 (VICH GL48) Studies to Evaluate the Metabolism and Residue Kinetics of Veterinary Drugs In Food-Producing Animals: Marker Residue Depletion Studies to Establish Product Withdrawal Periods,Visit the link for more information,https://www.fda.gov/regulatory-information/search-fda-guidance-documents/cvm-gfi-207-vich-gl48-studies-evaluate-metabolism-and-residue-kinetics-veterinary-drugs-food
FDA,Guidance,CVM GFI #208 (VICH GL49) Studies to Evaluate the Metabolism and Residue Kinetics of Veterinary Drugs in Food-Producing Animals: Validation of Analytical Methods Used in Residue Depletion Studies,Visit the link for more information,https://www.fda.gov/regulatory-information/search-fda-guidance-documents/cvm-gfi-208-vich-gl49-studies-evaluate-metabolism-and-residue-kinetics-veterinary-drugs-food
FDA,Guidance,"Determining the Need for and Content of Environmental Assessments for Gene Therapies, Vectored Vaccines, and Related Recombinant Viral or Microbial Products:  Guidance for Industry",Visit the link for more information,https://www.fda.gov/regulatory-information/search-fda-guidance-documents/determining-need-and-content-environmental-assessments-gene-therapies-vectored-vaccines-and-related
FDA,Guidance,Alcoholism:  Developing Drugs for Treatment,Visit the link for more information,https://www.fda.gov/regulatory-information/search-fda-guidance-documents/alcoholism-developing-drugs-treatment
FDA,Guidance,Safety Considerations to Mitigate the Risks of Misconnections with Small-bore Connectors Intended for Enteral Applications:  Guidance for Industry and Food and Drug Administration Staff,Visit the link for more information,https://www.fda.gov/regulatory-information/search-fda-guidance-documents/safety-considerations-mitigate-risks-misconnections-small-bore-connectors-intended-enteral
FDA,Guidance,S10 Photosafety Evaluation of Pharmaceuticals,Visit the link for more information,https://www.fda.gov/regulatory-information/search-fda-guidance-documents/s10-photosafety-evaluation-pharmaceuticals
FDA,Guidance,DSCSA Implementation: Product Tracing Requirements — Compliance Policy,Visit the link for more information,https://www.fda.gov/regulatory-information/search-fda-guidance-documents/dscsa-implementation-product-tracing-requirements-compliance-policy
FDA,Guidance,Minimizing Risk for Children's Toy Laser Products:   Guidance for Industry and Food and Drug Administration Staff,Visit the link for more information,https://www.fda.gov/regulatory-information/search-fda-guidance-documents/minimizing-risk-childrens-toy-laser-products
FDA,Guidance,"Providing Regulatory Submissions in Electronic Format — Submissions Under Section 745A(a) of the Federal Food, Drug, and Cosmetic Act",Visit the link for more information,https://www.fda.gov/regulatory-information/search-fda-guidance-documents/providing-regulatory-submissions-electronic-format-submissions-under-section-745aa-federal-food-drug
FDA,Guidance,"CPG Sec 540.275 (Draft) Crabmeat - Fresh and Frozen - Adulteration with Filth, Involving the Presence of Escherichia coli",Visit the link for more information,https://www.fda.gov/regulatory-information/search-fda-guidance-documents/cpg-sec-540275-draft-crabmeat-fresh-and-frozen-adulteration-filth-involving-presence-escherichia
FDA,Guidance,Patient Counseling Information Section of Labeling for Human Prescription Drug and Biological Products — Content and Format,Visit the link for more information,https://www.fda.gov/regulatory-information/search-fda-guidance-documents/patient-counseling-information-section-labeling-human-prescription-drug-and-biological-products
FDA,Guidance,DSCSA Implementation: Annual Reporting by Prescription Drug Wholesale Distributors and Third-Party Logistics Providers,Visit the link for more information,https://www.fda.gov/regulatory-information/search-fda-guidance-documents/dscsa-implementation-annual-reporting-prescription-drug-wholesale-distributors-and-third-party
FDA,Guidance,SUPAC: Manufacturing Equipment Addendum,Visit the link for more information,https://www.fda.gov/regulatory-information/search-fda-guidance-documents/supac-manufacturing-equipment-addendum
FDA,Guidance,Infusion Pumps Total Product Life Cycle:  Guidance for Industry and FDA Staff,Visit the link for more information,https://www.fda.gov/regulatory-information/search-fda-guidance-documents/infusion-pumps-total-product-life-cycle
FDA,Guidance,Recommendations for Labeling Medical Products to Inform Users that the Product or Product Container is not Made with Natural Rubber Latex:  Guidance for Industry and Food and Drug Administration Staff,Visit the link for more information,https://www.fda.gov/regulatory-information/search-fda-guidance-documents/recommendations-labeling-medical-products-inform-users-product-or-product-container-not-made-natural
FDA,Guidance,CPG Sec 540.700 Labeling of Processed and Blended Seafood Products Made Primarily with Fish Protein,Visit the link for more information,https://www.fda.gov/regulatory-information/search-fda-guidance-documents/cpg-sec-540700-labeling-processed-and-blended-seafood-products-made-primarily-fish-protein
FDA,Guidance,Changes to an Approved Application: Biological Products: Human Blood and Blood Components Intended for Transfusion or for Further Manufacture:  Final Guidance,Visit the link for more information,https://www.fda.gov/regulatory-information/search-fda-guidance-documents/changes-approved-application-biological-products-human-blood-and-blood-components-intended
FDA,Guidance,"Registration for Human Drug Compounding Outsourcing Facilities Under Section 503B of the Federal Food, Drug, and Cosmetic Act",Visit the link for more information,https://www.fda.gov/regulatory-information/search-fda-guidance-documents/registration-human-drug-compounding-outsourcing-facilities-under-section-503b-federal-food-drug-and
FDA,Guidance,Design Considerations for Devices Intended for Home Use:  Guidance for Industry and Food and Drug Administration Staff,Visit the link for more information,https://www.fda.gov/regulatory-information/search-fda-guidance-documents/design-considerations-devices-intended-home-use
FDA,Guidance,Vaginal Microbicides:Development for the Prevention of HIV Infection PDF,Visit the link for more information,https://www.fda.gov/regulatory-information/search-fda-guidance-documents/vaginal-microbicidesdevelopment-prevention-hiv-infection-pdf
FDA,Guidance,Molecular Diagnostic Instruments with Combined Functions:  Guidance for Industry and Food and Drug Administration Staff,Visit the link for more information,https://www.fda.gov/regulatory-information/search-fda-guidance-documents/molecular-diagnostic-instruments-combined-functions
FDA,Guidance,Specification of the Unique Facility Identifier (UFI) System for Drug Establishment,Visit the link for more information,https://www.fda.gov/regulatory-information/search-fda-guidance-documents/specification-unique-facility-identifier-ufi-system-drug-establishment
FDA,Guidance,New Chemical Entity Exclusivity Determinations for Certain Fixed-Combination Drug Products,Visit the link for more information,https://www.fda.gov/regulatory-information/search-fda-guidance-documents/new-chemical-entity-exclusivity-determinations-certain-fixed-combination-drug-products
FDA,Guidance,Distinguishing Medical Device Recalls from Medical Device Enhancements:  Guidance for Industry and Food and Drug Administration Staff,Visit the link for more information,https://www.fda.gov/regulatory-information/search-fda-guidance-documents/distinguishing-medical-device-recalls-medical-device-enhancements
FDA,Guidance,CVM GFI #143 (VICH GL30) Pharmacovigilance of Veterinary Medicinal Products: Controlled List of Terms,Visit the link for more information,https://www.fda.gov/regulatory-information/search-fda-guidance-documents/cvm-gfi-143-vich-gl30-pharmacovigilance-veterinary-medicinal-products-controlled-list-terms
FDA,Guidance,CVM GFI #224 (Supplement to VICH GL52) Supplemental Examples For Illustrating Statistical Concepts Described in the VICH In Vivo Bioequivalence Guidance GL52,Visit the link for more information,https://www.fda.gov/regulatory-information/search-fda-guidance-documents/cvm-gfi-224-supplement-vich-gl52-supplemental-examples-illustrating-statistical-concepts-described
FDA,Guidance,Custom Device Exemption:  Guidance for Industry and Food and Drug Administration Staff,Visit the link for more information,https://www.fda.gov/regulatory-information/search-fda-guidance-documents/custom-device-exemption
FDA,Guidance,Highly Multiplexed Microbiological/Medical Countermeasure In Vitro Nucleic Acid Based Diagnostic Devices:  Guidance for Industry and Food and Drug Administration Staff,Visit the link for more information,https://www.fda.gov/regulatory-information/search-fda-guidance-documents/highly-multiplexed-microbiologicalmedical-countermeasure-in-vitro-nucleic-acid-based-diagnostic-devices
FDA,Guidance,Evaluation of Sex-Specific Data in Medical Device Clinical Studies - Guidance for Industry and Food and Drug Administration Staff,Visit the link for more information,https://www.fda.gov/regulatory-information/search-fda-guidance-documents/evaluation-sex-specific-data-medical-device-clinical-studies-guidance-industry-and-food-and-drug
FDA,Guidance,"Unique Device Identifier System: Frequently Asked Questions, Vol. 1 :  Guidance for Industry and Food and Drug Administration Staff",Visit the link for more information,https://www.fda.gov/regulatory-information/search-fda-guidance-documents/unique-device-identifier-system-frequently-asked-questions-vol-1
FDA,Guidance,"FDA Decisions for Investigational Device Exemption Clinical Investigations:  Guidance for Sponsors, Clinical Investigators, Institutional Review Boards, and Food and Drug Administration Staff",Visit the link for more information,https://www.fda.gov/regulatory-information/search-fda-guidance-documents/fda-decisions-investigational-device-exemption-clinical-investigations
FDA,Guidance,Immunogenicity Assessment for Therapeutic Protein Products,Visit the link for more information,https://www.fda.gov/regulatory-information/search-fda-guidance-documents/immunogenicity-assessment-therapeutic-protein-products
FDA,Guidance,Unique Device Identification System: Small Entity Compliance Guide:  Guidance for Industry and Food and Drug Administration Staff,Visit the link for more information,https://www.fda.gov/regulatory-information/search-fda-guidance-documents/unique-device-identification-system-small-entity-compliance-guide
FDA,Guidance,Upper Facial Lines:  Developing Botulinum Toxin Drug Products,Visit the link for more information,https://www.fda.gov/regulatory-information/search-fda-guidance-documents/upper-facial-lines-developing-botulinum-toxin-drug-products
FDA,Guidance,In Vitro Companion Diagnostic Devices:  Guidance for Industry and Food and Drug Administration Staff,Visit the link for more information,https://www.fda.gov/regulatory-information/search-fda-guidance-documents/in-vitro-companion-diagnostic-devices
FDA,Guidance,Reference Product Exclusivity for Biological Products Filed Under Section 351(a) of the PHS Act,Visit the link for more information,https://www.fda.gov/regulatory-information/search-fda-guidance-documents/reference-product-exclusivity-biological-products-filed-under-section-351a-phs-act
FDA,Guidance,CVM GFI #200 SECG for Designation of New Animal Drugs for Minor Uses or Minor Species,Visit the link for more information,https://www.fda.gov/regulatory-information/search-fda-guidance-documents/cvm-gfi-200-secg-designation-new-animal-drugs-minor-uses-or-minor-species
FDA,Guidance,CVM GFI #201 SECG for The Index of Legally Marketed Unapproved New Animal Drugs for Minor Species,Visit the link for more information,https://www.fda.gov/regulatory-information/search-fda-guidance-documents/cvm-gfi-201-secg-index-legally-marketed-unapproved-new-animal-drugs-minor-species
FDA,Guidance,The 510(k) Program: Evaluating Substantial Equivalence in Premarket Notifications [510(k)]:  Guidance for Industry and Food and Drug Administration Staff,Visit the link for more information,https://www.fda.gov/regulatory-information/search-fda-guidance-documents/510k-program-evaluating-substantial-equivalence-premarket-notifications-510k
FDA,Guidance,Reporting Drug Sample Information Under Section 6004 of the Affordable Care Act,Visit the link for more information,https://www.fda.gov/regulatory-information/search-fda-guidance-documents/reporting-drug-sample-information-under-section-6004-affordable-care-act
FDA,Guidance,Neglected Tropical Diseases of the Developing World: Developing Drugs for Treatment or Prevention,Visit the link for more information,https://www.fda.gov/regulatory-information/search-fda-guidance-documents/neglected-tropical-diseases-developing-world-developing-drugs-treatment-or-prevention
FDA,Guidance,"Pharmacy Compounding of Human Drug Products Under Section 503A of the Federal Food, Drug, and Cosmetic Act Guidance",Visit the link for more information,https://www.fda.gov/regulatory-information/search-fda-guidance-documents/pharmacy-compounding-human-drug-products-under-section-503a-federal-food-drug-and-cosmetic-act
FDA,Guidance,"Guidance for Industry: Assessing the Effects of Significant Manufacturing Process Changes, Including Emerging Technologies, on the Safety and Regulatory Status of Food Ingredients and Food Contact Substances, Including Food Ingredients that Are Color Additives",Visit the link for more information,https://www.fda.gov/regulatory-information/search-fda-guidance-documents/guidance-industry-assessing-effects-significant-manufacturing-process-changes-including-emerging
FDA,Guidance,Small Entity Compliance Guide: Gluten-Free Labeling of Foods,Visit the link for more information,https://www.fda.gov/regulatory-information/search-fda-guidance-documents/small-entity-compliance-guide-gluten-free-labeling-foods
FDA,Guidance,Guidance for Industry: Safety of Nanomaterials in Cosmetic Products,Visit the link for more information,https://www.fda.gov/regulatory-information/search-fda-guidance-documents/guidance-industry-safety-nanomaterials-cosmetic-products
FDA,Guidance,Considering Whether an FDA-Regulated Product Involves the Application of Nanotechnology:  Guidance for Industry,Visit the link for more information,https://www.fda.gov/regulatory-information/search-fda-guidance-documents/considering-whether-fda-regulated-product-involves-application-nanotechnology
FDA,Guidance,Criteria for Significant Risk Investigations of Magnetic Resonance Diagnostic Devices - Guidance for Industry and Food and Drug Administration Staff,Visit the link for more information,https://www.fda.gov/regulatory-information/search-fda-guidance-documents/criteria-significant-risk-investigations-magnetic-resonance-diagnostic-devices-guidance-industry-and
FDA,Guidance,Drug Master Files: Guidelines,Visit the link for more information,https://www.fda.gov/regulatory-information/search-fda-guidance-documents/drug-master-files-guidelines
FDA,Guidance,Internet/Social Media Platforms with Character Space Limitations— Presenting Risk and Benefit Information for Prescription Drugs and Medical Devices,Visit the link for more information,https://www.fda.gov/regulatory-information/search-fda-guidance-documents/internetsocial-media-platforms-character-space-limitations-presenting-risk-and-benefit-information
FDA,Guidance,Internet/Social Media Platforms with Character Space Limitations— Presenting Risk and Benefit Information for Prescription Drugs and Medical Devices,Visit the link for more information,https://www.fda.gov/regulatory-information/search-fda-guidance-documents/internetsocial-media-platforms-character-space-limitations-presenting-risk-and-benefit-information-0
FDA,Guidance,Q4B Annex 6: Uniformity of Dosage Units General Chapter,Visit the link for more information,https://www.fda.gov/regulatory-information/search-fda-guidance-documents/q4b-annex-6-uniformity-dosage-units-general-chapter
FDA,Guidance,Distributing Scientific and Medical Publications on Risk Information for Approved Prescription Drugs and Biological Products—Recommended Practices,Visit the link for more information,https://www.fda.gov/regulatory-information/search-fda-guidance-documents/distributing-scientific-and-medical-publications-risk-information-approved-prescription-drugs-and
FDA,Guidance,"Guidance for Industry: Demonstration of the Quality Factor Requirements Under 21 CFR 106.96(i) for ""Eligible"" Infant Formulas",Visit the link for more information,https://www.fda.gov/regulatory-information/search-fda-guidance-documents/guidance-industry-demonstration-quality-factor-requirements-under-21-cfr-10696i-eligible-infant
FDA,Guidance,CPG Sec 100.250 Food Facility Registration (Human and Animal Food),Visit the link for more information,https://www.fda.gov/regulatory-information/search-fda-guidance-documents/cpg-sec-100250-food-facility-registration-human-and-animal-food
FDA,Guidance,Expedited Programs for Serious Conditions | Drugs and Biologics,Visit the link for more information,https://www.fda.gov/regulatory-information/search-fda-guidance-documents/expedited-programs-serious-conditions-drugs-and-biologics
FDA,Guidance,CVM GFI #79 Dispute Resolution Procedures for Science-Based Decisions on Products Regulated by CVM,Visit the link for more information,https://www.fda.gov/regulatory-information/search-fda-guidance-documents/cvm-gfi-79-dispute-resolution-procedures-science-based-decisions-products-regulated-cvm
FDA,Guidance,"Considerations When Transferring Clinical Investigation Oversight to Another IRB:  Guidance for IRBs, Clinical Investigators, and Sponsors",Visit the link for more information,https://www.fda.gov/regulatory-information/search-fda-guidance-documents/considerations-when-transferring-clinical-investigation-oversight-another-irb
FDA,Guidance,"ANDAs: Stability Testing of Drug Substances and Products, Questions and Answers",Visit the link for more information,https://www.fda.gov/regulatory-information/search-fda-guidance-documents/andas-stability-testing-drug-substances-and-products-questions-and-answers
FDA,Guidance,CVM GFI #219 (VICH GL51) Statistical Evaluation of Stability Data,Visit the link for more information,https://www.fda.gov/regulatory-information/search-fda-guidance-documents/cvm-gfi-219-vich-gl51-statistical-evaluation-stability-data
FDA,Guidance,Hospital-Acquired Bacterial Pneumonia and Ventilator-Associated Bacterial Pneumonia: Developing Drugs for Treatment,Visit the link for more information,https://www.fda.gov/regulatory-information/search-fda-guidance-documents/hospital-acquired-bacterial-pneumonia-and-ventilator-associated-bacterial-pneumonia-developing-drugs
FDA,Guidance,Providing Information about Pediatric Uses of Medical Devices:  Guidance for Industry and FDA Staff,Visit the link for more information,https://www.fda.gov/regulatory-information/search-fda-guidance-documents/providing-information-about-pediatric-uses-medical-devices
FDA,Guidance,"Guidance for Industry: FDA Records Access Authority Under Sections 414 and 704 of the Federal Food, Drug, & Cosmetic Act",Visit the link for more information,https://www.fda.gov/regulatory-information/search-fda-guidance-documents/guidance-industry-fda-records-access-authority-under-sections-414-and-704-federal-food-drug-cosmetic
FDA,Guidance,Small Entity Compliance Guide: What You Need to Know About Establishment and Maintenance of Records,Visit the link for more information,https://www.fda.gov/regulatory-information/search-fda-guidance-documents/small-entity-compliance-guide-what-you-need-know-about-establishment-and-maintenance-records
FDA,Guidance,Types of Communication During the Review of Medical Device Submissions:  Guidance for Industry and FDA Staff,Visit the link for more information,https://www.fda.gov/regulatory-information/search-fda-guidance-documents/types-communication-during-review-medical-device-submissions
FDA,Guidance,"CPG Sec 550.050 Canned Ackee, Frozen Ackee, and Other Ackee Products- Hypoglycin A Toxin",Visit the link for more information,https://www.fda.gov/regulatory-information/search-fda-guidance-documents/cpg-sec-550050-canned-ackee-frozen-ackee-and-other-ackee-products-hypoglycin-toxin
FDA,Guidance,Interpreting Sameness of Monoclonal Antibody Products Under the Orphan Drug Regulations,Visit the link for more information,https://www.fda.gov/regulatory-information/search-fda-guidance-documents/interpreting-sameness-monoclonal-antibody-products-under-orphan-drug-regulations
FDA,Guidance,"The Meaning of ""Spouse"" and ""Family"" in FDA's Regulations after the Supreme Court's Ruling in United States v. Windsor: Questions and Answers:  Guidance for Industry, Consumers, and FDA Staff",Visit the link for more information,https://www.fda.gov/regulatory-information/search-fda-guidance-documents/meaning-spouse-and-family-fdas-regulations-after-supreme-courts-ruling-united-states-v-windsor
FDA,Guidance,Medical Device Tracking :  Guidance for Industry and FDA Staff,Visit the link for more information,https://www.fda.gov/regulatory-information/search-fda-guidance-documents/medical-device-tracking
FDA,Guidance,Premarket Assessment of Pediatric Medical Devices:  Guidance for Industry and FDA Staff,Visit the link for more information,https://www.fda.gov/regulatory-information/search-fda-guidance-documents/premarket-assessment-pediatric-medical-devices
FDA,Guidance,Bioavailability and Bioequivalence Studies Submitted in NDAs or INDs — General Considerations,Visit the link for more information,https://www.fda.gov/regulatory-information/search-fda-guidance-documents/bioavailability-and-bioequivalence-studies-submitted-ndas-or-inds-general-considerations
FDA,Guidance,Chronic Fatigue Syndrome/Myalgic Encephalomyelitis:  Developing Drug Products for Treatment,Visit the link for more information,https://www.fda.gov/regulatory-information/search-fda-guidance-documents/chronic-fatigue-syndromemyalgic-encephalomyelitis-developing-drug-products-treatment
FDA,Guidance,CMC Postapproval Manufacturing Changes To Be Documented in Annual Reports,Visit the link for more information,https://www.fda.gov/regulatory-information/search-fda-guidance-documents/cmc-postapproval-manufacturing-changes-be-documented-annual-reports
FDA,Guidance,"BLA for Minimally Manipulated, Unrelated Allogeneic Placental/Umbilical Cord Blood Intended for Hematopoietic and Immunologic Reconstitution in Patients with Disorders Affecting the Hematopoietic System:  Guidance for Industry",Visit the link for more information,https://www.fda.gov/regulatory-information/search-fda-guidance-documents/bla-minimally-manipulated-unrelated-allogeneic-placentalumbilical-cord-blood-intended-hematopoietic
FDA,Guidance,"IND Applications for Minimally Manipulated, Unrelated Allogeneic Placental/Umbilical Cord Blood Intended for Hematopoietic and Immunologic Reconstitution in Patients with Disorders Affecting the Hematopoietic System:  Guidance for Industry and FDA Staff",Visit the link for more information,https://www.fda.gov/regulatory-information/search-fda-guidance-documents/ind-applications-minimally-manipulated-unrelated-allogeneic-placentalumbilical-cord-blood-intended
FDA,Guidance,Antiviral Product Development — Conducting and Submitting Virology Studies to the Agency: Guidance for Submitting HIV-1 Resistance Data: Attachment to the Guidance: Draft Draft Guidance: This draft guidance updates the final guidance posted 6/2/06,Visit the link for more information,https://www.fda.gov/regulatory-information/search-fda-guidance-documents/antiviral-product-development-conducting-and-submitting-virology-studies-agency-guidance-submitting-4
FDA,Guidance,"Public Availability of Advisory Committee Members' Financial Interest Information and Waivers:  Guidance for the Public, FDA Advisory Committee Members, and FDA Staff",Visit the link for more information,https://www.fda.gov/regulatory-information/search-fda-guidance-documents/public-availability-advisory-committee-members-financial-interest-information-and-waivers
FDA,Guidance,The Electronic Transmission of Individual Case Safety Reports Implementation Guide — Data Elements and Message Specification,Visit the link for more information,https://www.fda.gov/regulatory-information/search-fda-guidance-documents/electronic-transmission-individual-case-safety-reports-implementation-guide-data-elements-and
FDA,Guidance,"Questions and Answers about eMDR - Electronic Medical Device Reporting - Guidance for Industry, User Facilities and FDA Staff",Visit the link for more information,https://www.fda.gov/regulatory-information/search-fda-guidance-documents/questions-and-answers-about-emdr-electronic-medical-device-reporting-guidance-industry-user
FDA,Guidance,Providing Regulatory Submissions in Electronic Format--Receipt Date:  Guidance for Industry,Visit the link for more information,https://www.fda.gov/regulatory-information/search-fda-guidance-documents/providing-regulatory-submissions-electronic-format-receipt-date
FDA,Guidance,"Guidance for Industry: Considerations Regarding Substances Added to Foods, Including Beverages and Dietary Supplements",Visit the link for more information,https://www.fda.gov/regulatory-information/search-fda-guidance-documents/guidance-industry-considerations-regarding-substances-added-foods-including-beverages-and-dietary
