ASD Acronym,Designation,Title of Standard,Link
,ISO 13212:2014,Ophthalmic optics   Contact lens care products  Guidelines for determination of shelf-life,https://www.iso.org/standard/61684.html
,ISO 13230:1999,Ophthalmic optics  Bar code specifications,https://www.iso.org/standard/21454.html
,ISO 13666:2019,Ophthalmic optics  Spectacle lenses  Vocabulary,https://www.iso.org/standard/68450.html
,ISO 14534:2011,Ophthalmic optics  Contact lenses and contact lens care products  Fundamental requirements,https://www.iso.org/standard/51051.html
,ISO 14729:2001 /Amd 1:2010,Ophthalmic optics  Contact lens care products  Microbiological requirements and test methods for products and regimens for hygienic management of contact lenses  Amendment 1,https://www.iso.org/standard/51069.html
,ISO 14730:2014,Ophthalmic optics  Contact lens care products  Antimicrobial preservative efficacy testing and guidance on determining discard date,https://www.iso.org/standard/65165.html
,ISO 14889:2013 /Amd 1:2017,Ophthalmic optics  Spectacle lenses  Fundamental requirements for uncut finished lenses  Amendment 1,https://www.iso.org/standard/72292.html
,ISO 15004-1:2020,Ophthalmic instruments  Fundamental requirements and test methods  Part 1: General requirements applicable to all ophthalmic instruments,https://www.iso.org/standard/72616.html
,ISO 15004-2:2007,Ophthalmic instruments  Fundamental requirements and test methods  Part 2: Light hazard protection,https://www.iso.org/standard/38952.html
,ISO 15004:1997,Ophthalmic instruments  Fundamental requirements and test methods,https://www.iso.org/standard/26191.html
,ISO 15253:2021,Ophthalmic optics and instruments  Optical and electro-optical devices for enhancing low vision,https://www.iso.org/standard/79918.html
,ISO 15254:2009,Ophthalmic optics and instruments  Electro-optical devices for enhancing low vision,https://www.iso.org/standard/52493.html
,ISO 15752:2010,Ophthalmic instruments  Endoilluminators  Fundamental requirements and test methods for optical radiation safety,https://www.iso.org/standard/44164.html
,ISO 15798:2022,Ophthalmic implants  Ophthalmic viscosurgical devices,https://www.iso.org/standard/79687.html
,ISO 16034:2002 /Cor 1:2006,Ophthalmic optics  Specifications for single-vision ready-to-wear near- vision spectacles  Technical Corrigendum 1,https://www.iso.org/standard/44515.html
,ISO 16284:2006,Ophthalmic optics  Information interchange for ophthalmic optical equipment,https://www.iso.org/standard/40120.html
,ISO 16671:2015 /Amd 1:2017,Ophthalmic implants  Irrigating solutions for ophthalmic surgery  Amendment 1,https://www.iso.org/standard/72615.html
,ISO 16672:2020,Ophthalmic implants  Ocular endotamponades,https://www.iso.org/standard/70806.html
,ISO 16971:2015,Ophthalmic instruments  Optical coherence tomograph for the posterior segment of the human eye,https://www.iso.org/standard/58076.html
,ISO 18189:2016,Ophthalmic optics  Contact lenses and contact lens care products  Cytotoxicity testing of contact lenses in combination with lens care solution to evaluate lens/solution interactions,https://www.iso.org/standard/61727.html
,ISO 18259:2014,Ophthalmic optics  Contact lens care products  Method to assess contact lens care products with contact lenses in a lens case challenged with bacterial and fungal organisms,https://www.iso.org/standard/61901.html
,ISO 18369-1:2017,Ophthalmic optics  Contact lenses  Part 1: Vocabulary classification system and recommendations for labelling specifications,https://www.iso.org/standard/66338.html
,ISO 18369-2:2017,Ophthalmic optics  Contact lenses  Part 2: Tolerances,https://www.iso.org/standard/66339.html
,ISO 18369-3:2017,Ophthalmic optics  Contact lenses  Part 3: Measurement methods,https://www.iso.org/standard/66340.html
,ISO 18369-4:2017,Ophthalmic optics  Contact lenses  Part 4: Physicochemical properties of contact lens materials,https://www.iso.org/standard/66341.html
,ISO/TR 18476:2017,Ophthalmic optics and instruments  Free form technology  Spectacle lenses and measurement,https://www.iso.org/standard/62547.html
,ISO 19045:2015,Ophthalmic optics  Contact lens care products  Method for evaluating Acanthamoeba encystment by contact lens care products,https://www.iso.org/standard/63807.html
,ISO/TR 19498:2015,Ophthalmic optics and instruments  Correlation of optotypes,https://www.iso.org/standard/65193.html
,ISO 19979:2018,Ophthalmic optics  Contact lenses  Hygienic management of multipatient use trial contact lenses,https://www.iso.org/standard/67859.html
,ISO/TS 19979:2014,Ophthalmic optics  Contact lenses  Hygienic management of multipatient use trial contact lenses,https://www.iso.org/standard/66337.html
,ISO 19980:2021,Ophthalmic instruments  Corneal topographers,https://www.iso.org/standard/75922.html
,ISO/TR 20772:2018,Ophthalmic optics  Spectacle lenses  Short wavelength visible solar radiation and the eye,https://www.iso.org/standard/69041.html
,ISO/TR 20824:2007,Ophthalmic instruments  Background for light hazard specification in ophthalmic instrument standards,https://www.iso.org/standard/44372.html
,ISO/TR 21958:2019,Ophthalmic optics  Review of the test methods used to assess scratch and abrasion resistance of spectacle lenses,https://www.iso.org/standard/72293.html
,ISO 21987:2017,Ophthalmic optics  Mounted spectacle lenses,https://www.iso.org/standard/65161.html
,ISO 22665:2012,Ophthalmic optics and instruments - Instruments to measure axial distances in the eye,https://www.iso.org/standard/36390.html
,ISO/TR 22979:2017,Ophthalmic implants  Intraocular lenses  Guidance on assessment of the need for clinical investigation of intraocular lens design modifications,https://www.iso.org/standard/61830.html
,ISO 24157:2008 /Amd 1:2020,Ophthalmic optics and instruments  Reporting aberrations of the human eye  Amendment 1,https://www.iso.org/standard/75923.html
,ISO/TS 24348:2014,Ophthalmic optics  Spectacle frames  Method for the simulation of wear and detection of nickel release from metal and combination spectacle frames,https://www.iso.org/standard/61819.html
,ISO/TR 28980:2007,Ophthalmic optics  Spectacle lenses  Parameters affecting lens power measurement,https://www.iso.org/standard/41182.html
,IEC 80601-2-58:2024,Medical electrical equipment  Part 2-58: Particular requirements for basic safety and essential performance of lens removal devices and vitrectomy devices for ophthalmic surgery,https://www.iso.org/standard/82719.html
,ISO 3665:1976,Photography  Intra-oral dental radiographic film  Specification,https://www.iso.org/standard/9118.html
,ISO 7376-2:1997,Laryngoscopic fittings  Part 2: Miniature electric lamps  Screw threads and sockets for conventional blades,https://www.iso.org/standard/14073.html
,ISO 21439:2009,Clinical dosimetry  Beta radiation sources for brachytherapy,https://www.iso.org/standard/40240.html
,ISO 4307:2021,Molecular in vitro diagnostic examinations  Specifications for pre-examination processes for saliva  Isolated human DNA,https://www.iso.org/standard/79865.html
,ISO 6717:2021,In vitro diagnostic medical devices  Single-use containers for the collection of specimens from humans other than blood,https://www.iso.org/standard/80907.html
,ISO 13079:2011,Laboratory glass and plastics ware  Tubes for the measurement of the erythrocyte sedimentation rate by the Westergren method,https://www.iso.org/standard/52663.html
,ISO 15193:2009,In vitro diagnostic medical devices  Measurement of quantities in samples of biological origin  Requirements for content and presentation of reference measurement procedures,https://www.iso.org/standard/42021.html
,ISO 15194:2009,In vitro diagnostic medical devices  Measurement of quantities in samples of biological origin  Requirements for certified reference materials and the content of supporting documentation,https://www.iso.org/standard/42022.html
,ISO 15197:2013,In vitro diagnostic test systems  Requirements for blood-glucose monitoring systems for self-testing in managing diabetes mellitus,https://www.iso.org/standard/54976.html
,ISO 15198:2004,Clinical laboratory medicine  In vitro diagnostic medical devices  Validation of user quality control procedures by the manufacturer,https://www.iso.org/standard/39751.html
,ISO 16256:2021,Clinical laboratory testing and in vitro diagnostic test systems  Broth micro-dilution reference method for testing the in vitro activity of antimicrobial agents against yeast fungi involved in infectious diseases,https://www.iso.org/standard/79379.html
,ISO 17511:2020,In vitro diagnostic medical devices  Requirements for establishing metrological traceability of values assigned to calibrators trueness control materials and human samples,https://www.iso.org/standard/69984.html
,ISO/TR 18112:2006,Clinical laboratory testing and in vitro diagnostic test systems  In vitro diagnostic medical devices for professional use  Summary of regulatory requirements for information supplied by the manufacturer,https://www.iso.org/standard/38590.html
,ISO 18113-1:2022,In vitro diagnostic medical devices  Information supplied by the manufacturer (labelling)  Part 1: Terms definitions and general requirements,https://www.iso.org/standard/79866.html
,ISO 18113-2:2022,In vitro diagnostic medical devices  Information supplied by the manufacturer (labelling)  Part 2: In vitro diagnostic reagents for professional use,https://www.iso.org/standard/79867.html
,ISO 18113-3:2022,In vitro diagnostic medical devices  Information supplied by the manufacturer (labelling)  Part 3: In vitro diagnostic instruments for professional use,https://www.iso.org/standard/79868.html
,ISO 18113-4:2022,In vitro diagnostic medical devices  Information supplied by the manufacturer (labelling)  Part 4: In vitro diagnostic reagents for self-testing,https://www.iso.org/standard/79869.html
,ISO 18113-5:2022,In vitro diagnostic medical devices  Information supplied by the manufacturer (labelling)  Part 5: In vitro diagnostic instruments for self-testing,https://www.iso.org/standard/79870.html
,ISO 18153:2003,In vitro diagnostic medical devices  Measurement of quantities in biological samples  Metrological traceability of values for catalytic concentration of enzymes assigned calibrators and control materials,https://www.iso.org/standard/31718.html
,ISO 19001:2013,In vitro diagnostic medical devices  Information supplied by the manufacturer with in vitro diagnostic reagents for staining in biology,https://www.iso.org/standard/51984.html
,ISO 20166-1:2018,Molecular in vitro diagnostic examinations  Specifications for pre-examination processes for formalin-fixed and paraffin-embedded (FFPE) tissue  Part 1: Isolated RNA,https://www.iso.org/standard/67179.html
,ISO 20166-2:2018,Molecular in vitro diagnostic examinations  Specifications for pre-examinations processes for formalin-fixed and paraffin-embedded (FFPE) tissue  Part 2: Isolated proteins,https://www.iso.org/standard/69802.html
,ISO 20166-3:2018,Molecular in vitro diagnostic examinations  Specifications for pre-examination processes for formalin-fixed and paraffin-embedded (FFPE) tissue  Part 3: Isolated DNA,https://www.iso.org/standard/69803.html
,ISO 20166-4:2021,Molecular in vitro diagnostic examinations  Specifications for preexamination processes for formalin-fixed and paraffin-embedded (FFPE) tissue  Part 4: In situ detection techniques,https://www.iso.org/standard/75442.html
,ISO 20184-1:2018,Molecular in vitro diagnostic examinations  Specifications for pre-examination processes for frozen tissue  Part 1: Isolated RNA,https://www.iso.org/standard/67215.html
,ISO 20184-2:2018,Molecular in vitro diagnostic examinations  Specifications for pre-examination processes for frozen tissue  Part 2: Isolated proteins,https://www.iso.org/standard/69801.html
,ISO 20184-3:2021,Molecular in vitro diagnostic examinations  Specifications for pre-examination processes for frozen tissue  Part 3: Isolated DNA,https://www.iso.org/standard/78110.html
,ISO 20186-1:2019,Molecular in vitro diagnostic examinations  Specifications for pre-examination processes for venous whole blood  Part 1: Isolated cellular RNA,https://www.iso.org/standard/67217.html
,ISO 20186-2:2019,Molecular in vitro diagnostic examinations  Specifications for pre-examination processes for venous whole blood  Part 2: Isolated genomic DNA,https://www.iso.org/standard/69799.html
,ISO 20186-3:2019,Molecular in vitro diagnostic examinations  Specifications for pre-examination processes for venous whole blood  Part 3: Isolated circulating cell free DNA from plasma,https://www.iso.org/standard/69800.html
,ISO 20916:2019,In vitro diagnostic medical devices  Clinical performance studies using specimens from human subjects  Good study practice,https://www.iso.org/standard/69455.html
,ISO 21151:2020,In vitro diagnostic medical devices  Requirements for international harmonisation protocols establishing metrological traceability of values assigned to calibrators and human samples,https://www.iso.org/standard/69985.html
,ISO 21474-1:2020,In vitro diagnostic medical devices  Multiplex molecular testing for nucleic acids  Part 1: Terminology and general requirements for nucleic acid quality evaluation,https://www.iso.org/standard/70960.html
,ISO 21474-2:2022,In vitro diagnostic medical devices  Multiplex molecular testing for nucleic acids  Part 2: Validation and verification,https://www.iso.org/standard/78024.html
,ISO 23118:2021,Molecular in vitro diagnostic examinations  Specifications for pre-examination processes in metabolomics in urine venous blood serum and plasma,https://www.iso.org/standard/74605.html
,ISO 23640:2011,In vitro diagnostic medical devices  Evaluation of stability of in vitro diagnostic reagents,https://www.iso.org/standard/54868.html
,ISO 29701:2010,Nanotechnologies  Endotoxin test on nanomaterial samples for in vitro systems  Limulus amebocyte lysate (LAL) test,https://www.iso.org/standard/45640.html
,ISO/TR 7405:1984,Biological evaluation of dental materials,https://www.iso.org/standard/14133.html
,ISO 10993-1:2018,Biological evaluation of medical devices  Part 1: Evaluation and testing within a risk management process,https://www.iso.org/standard/68936.html
,ISO 10993-3:2014,Biological evaluation of medical devices  Part 3: Tests for genotoxicity carcinogenicity and reproductive toxicity,https://www.iso.org/standard/55614.html
,ISO 10993-4:2017 /DAmd 1,Biological evaluation of medical devices  Part 4: Selection of tests for interactions with blood  Amendment 1,https://www.iso.org/standard/86862.html
,ISO 10993-5:2009,Biological evaluation of medical devices  Part 5: Tests for in vitro cytotoxicity,https://www.iso.org/standard/36406.html
,ISO/TR 10993-9:1994,Biological evaluation of medical devices  Part 9: Degradation of materials related to biological testing,https://www.iso.org/standard/18970.html
,ISO 10993-10:2021,Biological evaluation of medical devices  Part 10: Tests for skin sensitization,https://www.iso.org/standard/75279.html
,ISO 10993-12:2021 /DAmd 1,Biological evaluation of medical devices  Part 12: Sample preparation and reference materials  Amendment 1,https://www.iso.org/standard/88205.html
,ISO 14155:2020,Clinical investigation of medical devices for human subjects  Good clinical practice,https://www.iso.org/standard/71690.html
,ISO/TS 5441:2024,Competence requirements for biorisk management advisors,https://www.iso.org/standard/81240.html
,ISO/TS 5798:2022,In vitro diagnostic test systems  Requirements and recommendations for detection of severe acute respiratory syndrome coronavirus 2 (SARS-CoV-2) by nucleic acid amplification methods,https://www.iso.org/standard/81712.html
,ISO 7713:1985,Laboratory glassware  Disposable serological pipettes,https://www.iso.org/standard/14541.html
,ISO 12771:1997,Plastics laboratory ware  Disposable serological pipettes,https://www.iso.org/standard/1699.html
,ISO 12772:1997,Laboratory glassware  Disposable microhaematocrit capillary tubes,https://www.iso.org/standard/1816.html
,ISO 13130:2011,Laboratory glassware  Desiccators,https://www.iso.org/standard/53051.html
,ISO 13132:2023,Laboratory glassware  Petri dishes,https://www.iso.org/standard/82979.html
,ISO 15189:2022,Medical laboratories  Requirements for quality and competence,https://www.iso.org/standard/76677.html
,ISO 15190:2020,Medical laboratories  Requirements for safety,https://www.iso.org/standard/72191.html
,ISO/TS 17518:2015,Medical laboratories  Reagents for staining biological material  Guidance for users,https://www.iso.org/standard/59944.html
,ISO/TS 17822-1:2014,In vitro diagnostic test systems  Qualitative nucleic acid-based in vitro examination procedures for detection and identification of microbial pathogens  Part 1: General requirements terms and definitions,https://www.iso.org/standard/60601.html
,ISO 17822:2020,In vitro diagnostic test systems  Nucleic acid amplification-based examination procedures for detection and identification of microbial pathogens  Laboratory quality practice guide,https://www.iso.org/standard/67022.html
,ISO 20658:2023,Requirements for the collection and transport of samples for medical laboratory examinations,https://www.iso.org/standard/80035.html
,ISO/TS 20658:2017,Medical laboratories  Requirements for collection transport receipt and handling of samples,https://www.iso.org/standard/68763.html
,ISO/TS 20914:2019,Medical laboratories  Practical guidance for the estimation of measurement uncertainty,https://www.iso.org/standard/69445.html
,ISO 22367:2020,Medical laboratories  Application of risk management to medical laboratories,https://www.iso.org/standard/71254.html
,ISO/TS 22367:2008 /Cor 1:2009,Medical laboratories  Reduction of error through risk management and continual improvement  Technical Corrigendum 1,https://www.iso.org/standard/53345.html
,ISO/TS 22583:2019,Guidance for supervisors and operators of point-of-care testing (POCT) devices,https://www.iso.org/standard/73506.html
,ISO/TR 22869:2005,Medical laboratories  Guidance on laboratory implementation of ISO 15189: 2003,https://www.iso.org/standard/35172.html
,ISO 22870:2016,Point-of-care testing (POCT)  Requirements for quality and competence,https://www.iso.org/standard/71119.html
,ISO 23162:2021,Basic semen examination  Specification and test methods,https://www.iso.org/standard/74800.html
,ISO/TS 23824:2024,Medical laboratories  Guidance on application of ISO 15189 in anatomic pathology,https://www.iso.org/standard/77070.html
,ISO 24998:2008,Plastics laboratory ware   Single-use Petri dishes for microbiological procedures,https://www.iso.org/standard/42736.html
,ISO 35001:2019 /Amd 1:2024,Biorisk management for laboratories and other related organisations  Amendment 1: Climate action changes,https://www.iso.org/standard/88418.html
,ISO 10993-2:2022,Biological evaluation of medical devices  Part 2: Animal welfare requirements,https://www.iso.org/standard/78866.html
,ISO 10993-6:2016,Biological evaluation of medical devices  Part 6: Tests for local effects after implantation,https://www.iso.org/standard/61089.html
,ISO 10993-7:2008 /Cor 1:2009,Biological evaluation of medical devices  Part 7: Ethylene oxide sterilization residuals  Technical Corrigendum 1,https://www.iso.org/standard/55064.html
,ISO 10993-8:2000,Biological evaluation of medical devices  Part 8: Selection and qualification of reference materials for biological tests,https://www.iso.org/standard/18969.html
,ISO 10993-9:2019,Biological evaluation of medical devices  Part 9: Framework for identification and quantification of potential degradation products,https://www.iso.org/standard/64580.html
,ISO 10993-11:2017,Biological evaluation of medical devices  Part 11: Tests for systemic toxicity,https://www.iso.org/standard/68426.html
,ISO 10993-13:2010,Biological evaluation of medical devices  Part 13: Identification and quantification of degradation products from polymeric medical devices,https://www.iso.org/standard/44050.html
,ISO 10993-14:2001,Biological evaluation of medical devices  Part 14: Identification and quantification of degradation products from ceramics,https://www.iso.org/standard/22693.html
,ISO 10993-15:2019,Biological evaluation of medical devices  Part 15: Identification and quantification of degradation products from metals and alloys,https://www.iso.org/standard/68937.html
,ISO 10993-16:2017,Biological evaluation of medical devices  Part 16: Toxicokinetic study design for degradation products and leachables,https://www.iso.org/standard/64582.html
,ISO 10993-17:2023 /DAmd 1,Biological evaluation of medical devices  Part 17: Toxicological risk assessment of medical device constituents  Amendment 1,https://www.iso.org/standard/88201.html
,ISO 10993-18:2020 /Amd 1:2022,Biological evaluation of medical devices  Part 18: Chemical characterization of medical device materials within a risk management process  Amendment 1: Determination of the uncertainty factor,https://www.iso.org/standard/82241.html
,ISO/TS 10993-19:2020,Biological evaluation of medical devices  Part 19: Physico-chemical morphological and topographical characterization of materials,https://www.iso.org/standard/75138.html
,ISO/TS 10993-20:2006,Biological evaluation of medical devices  Part 20: Principles and methods for immunotoxicology testing of medical devices,https://www.iso.org/standard/35979.html
,ISO/TR 10993-22:2017,Biological evaluation of medical devices  Part 22: Guidance on nanomaterials,https://www.iso.org/standard/65918.html
,ISO 10993-23:2021 /DAmd 1,Biological evaluation of medical devices  Part 23: Tests for irritation  Amendment 1: Additional in vitro reconstructed human epidermis models,https://www.iso.org/standard/88200.html
,ISO/TR 10993-33:2015,Biological evaluation of medical devices  Part 33: Guidance on tests to evaluate genotoxicity  Supplement to ISO 10993-3,https://www.iso.org/standard/65052.html
,ISO/TR 10993-55:2023,Biological evaluation of medical devices  Part 55: Interlaboratory study on cytotoxicity,https://www.iso.org/standard/71862.html
,ISO/TS 11796:2023,Biological evaluation of medical devices  Requirements for interlaboratory studies to demonstrate the applicability of validated in vitro methods to assess the skin sensitization of medical devices,https://www.iso.org/standard/83916.html
,ISO 13022:2012,Medical products containing viable human cells  Application of risk management and requirements for processing practices,https://www.iso.org/standard/52368.html
,ISO 14155-1:2003,Clinical investigation of medical devices for human subjects  Part 1: General requirements,https://www.iso.org/standard/31723.html
,ISO 14155-2:2003,Clinical investigation of medical devices for human subjects  Part 2: Clinical investigation plans,https://www.iso.org/standard/32217.html
,ISO/TR 15499:2016,Biological evaluation of medical devices  Guidance on the conduct of biological evaluation within a risk management process,https://www.iso.org/standard/69217.html
,ISO/TS 16782:2016,Clinical laboratory testing  Criteria for acceptable lots of dehydrated Mueller-Hinton agar and broth for antimicrobial susceptibility testing,https://www.iso.org/standard/72141.html
,ISO 17593:2022,Clinical laboratory testing and in vitro medical devices  Requirements for in vitro monitoring systems for self-testing of oral anticoagulant therapy,https://www.iso.org/standard/79378.html
,ISO 20776-1:2019,Susceptibility testing of infectious agents and evaluation of performance of antimicrobial susceptibility test devices  Part 1: Broth micro-dilution reference method for testing the in vitro activity of antimicrobial agents against rapidly growing aerobic bacteria involved in infectious diseases,https://www.iso.org/standard/70464.html
,ISO 20776-2:2021,Clinical laboratory testing and in vitro diagnostic test systems  Susceptibility testing of infectious agents and evaluation of performance of antimicrobial susceptibility test devices  Part 2: Evaluation of performance of antimicrobial susceptibility test devices against reference broth micro-dilution,https://www.iso.org/standard/79377.html
,ISO/TS 20993:2006,Biological evaluation of medical devices  Guidance on a risk-management process,https://www.iso.org/standard/36403.html
,ISO/TR 21582:2021,Pyrogenicity  Principles and methods for pyrogen testing of medical devices,https://www.iso.org/standard/71150.html
,ISO/TS 21726:2019,Biological evaluation of medical devices  Application of the threshold of toxicological concern (TTC) for assessing biocompatibility of medical device constituents,https://www.iso.org/standard/71514.html
,ISO 22442-1:2020,Medical devices utilizing animal tissues and their derivatives  Part 1: Application of risk management,https://www.iso.org/standard/74280.html
,ISO 22442-2:2020,Medical devices utilizing animal tissues and their derivatives  Part 2: Controls on sourcing collection and handling,https://www.iso.org/standard/74281.html
,ISO 22442-3:2007,Medical devices utilizing animal tissues and their derivatives  Part 3:  Validation of the elimination and/or inactivation of viruses and transmissible spongiform encephalopathy (TSE) agents,https://www.iso.org/standard/39351.html
,ISO/TR 22442-4:2010,Medical devices utilizing animal tissues and their derivatives  Part 4: Principles for elimination and/or inactivation of transmissible spongiform encephalopathy (TSE) agents and validation assays for those processes,https://www.iso.org/standard/51985.html
,ISO 7405:2018,Dentistry  Evaluation of biocompatibility of medical devices used in dentistry,https://www.iso.org/standard/71503.html
,ISO 15195:2018,Laboratory medicine  Requirements for the competence of calibration laboratories using reference measurement procedures,https://www.iso.org/standard/69824.html
