ASD Acronym,Designation,Title of Standard,Abstract,Link
ASTM,ASTM E2709-23,Standard Practice for Demonstrating Capability to Comply with an Acceptance Procedure,"""Significance and Use 4.1 This practice considers inspection procedures that may involve multiple-stage sampling, where at each stage one can decide to accept or to continue sampling, and the decision to reject is deferred until the last stage. 4.1.1 At each stage there are one or more acceptance criteria on the test results; for example, limits on each individual test result, or limits on statistics based on the sample of test results, such as the average, standard deviation, or coefficient of variation (relative standard deviation). 4.2 The methodology in this practice defines an acceptance region for a set of test results from the sampled population such that, at a prescribed confidence level, the probability that a sample from the population will pass the acceptance procedure is greater than or equal to a prespecified lower bound. 4.2.1 Having test results fall in the acceptance region is not equivalent to passing the acceptance procedure, but provides assurance that a sample would pass the acceptance procedure with a specified probability. 4.2.2 This information can be used for process demonstration, validation of test methods, and qualification of instruments, processes, and materials. 4.2.3 This information can be used for lot release (acceptance), but the lower bound may be conservative in some cases. 4.2.4 If the results are to be applied to future test results from the same process, then it is assumed that the process is stable and predictable. If this is not the case then there can be no guarantee that the probability estimates would be valid predictions of future process performance. 4.3 This methodology was originally developed ( 1- 4 ) 3 for use in two specific quality characteristics of drug products in the pharmaceutical industry but will be applicable for acceptance procedures in all industries. 4.4 Mathematical derivations would be required that are specific to the individual criteria of each test. Abstract This practice provides a general methodology for evaluating single-stage or multiple-stage acceptance procedures which involve a quality characteristic measured on a numerical scale. This methodology computes, at a prescribed confidence level, a lower bound on the probability of passing an acceptance procedure, using estimates of the parameters of the distribution of test results from a sampled population. Scope 1.1 This practice provides a general methodology for evaluating single-stage or multiple-stage acceptance procedures which involve a quality characteristic measured on a numerical scale. This methodology computes, at a prescribed confidence level, a lower bound on the probability of passing an acceptance procedure, using estimates of the parameters of the distribution of test results from a sampled population. 1.2 For a prescribed lower probability bound, the methodology can also generate an acceptance limit table, which defines a set of test method outcomes (for example, sample averages and standard deviations) that would pass the acceptance procedure at a prescribed confidence level. 1.3 This approach may be used for demonstrating compliance with in-process, validation, or lot-release specifications. 1.4 The system of units for this practice is not specified. 1.5 This standard does not purport to address all of the safety concerns, if any, associated with its use. It is the responsibility of the user of this standard to establish appropriate safety, health, and environmental practices and determine the applicability of regulatory limitations prior to use. 1.6 This international standard was developed in accordance with internationally recognized principles on standardization established in the Decision on Principles for the Development of International Standards, Guides and Recommendations issued by the World Trade Organization Technical Barriers to Trade (TBT) Committee. Version""",https://www.astm.org/E2709-23.html
ASTM,ASTM E2717-18,Standard Practice for Estimating the Environmental Load of Residential Wastewater,"""Significance and Use 5.1 There is increasing concern regarding water quality. The first national-scale U.S. examination of these organic wastewater contaminants in streams, conducted by the Toxic Substances Hydrology Program of the U.S. Geological Survey (USGS), indicated that a broad range of chemicals found in residential, industrial, and agricultural wastewaters commonly occurs in mixtures at low concentrations downstream from areas of intense urbanization and animal production. The chemicals include pharmaceuticals, natural and synthetic hormones, detergent metabolites, plasticizers, insecticides, and fire retardants. One or more of these chemicals were found in 80  % of the streams sampled. 6 5.2 This practice may be used by building owners and design professionals to assess water stewardship impacts of a residence. In particular, it is intended to inform design decisions and operation decisions regarding estimated wastewater quality impacts of a building. 5.3 This practice may be used by planners and water treatment professionals to assess water stewardship impacts of a residential area. In particular, it is intended to inform infrastructure decisions regarding estimated wastewater quality impacts of a residential service area. 5.3.1 This practice may be used to estimate the types and amounts of non-biological wastes entering a wastewater system. Such knowledge is becoming increasingly important in developing sustainable approaches to water stewardship. 5.4 Table 2, Environmental Load for Average U.S. Single-Family Home, does not list all chemicals used in homes; in order to obtain a more accurate estimation, the chemicals used in specific homes should be listed. In addition, it may be helpful to monitor wastewater to determine variances, if any, from the estimated environmental load. Scope 1.1 This practice provides a set of instructions for estimating the environmental load of residential water, as it is discharged from a residence. The environmental load is calculated based on the number and type of fixtures in the home, the common household chemicals used, and the number of people in the home. While the format is broadly applied internationally, the parameters stated herein reflect North American averages and would need to be modified if used elsewhere. 1.1.1 Averages Method   The Averages Method provides an estimate of the annual environmental load for the average U.S. single-family home based on 2000  U.S.  Census 2 and 2007 U.S.  Census  Data 3 and U.S.  EPA/625/R-00/008 characterization of residential wastewater flows. 4 Note 1: Census 2000, taken April 1, 2000, counted 281  421  906 people in the 50 states and the District of Columbia. The questionnaire included seven questions for each household: name, sex, age, relationship, Hispanic origin, race, and whether the housing unit was owned or rented. In addition to these seven questions, about 17 percent of the households got a much longer questionnaire including questions about ancestry, income, mortgage, and size of the housing unit. 1.1.2 Unique Product Parameters Method   The Unique Product Parameters Method provides an estimate of the annual environmental load, where the home/product parameter values are the same as those used for the Averages Method except for estimated amounts of chemical contaminants listed in Table 1 or average total annual use of products as listed in Table 1, or both. 1.1.3 Adjusted Averages Method   The Adjusted Averages Method provides an estimate of the annual environmental load, where home/product parameter values differ from those used for the Averages Method, except that chemical contaminants associated with products do not vary. ( Table 1 remains the same for: Typical Water Contaminants, Estimated Amount of Contaminant in Product (%), and the Percent Waste.) 1.1.4 Additional/Alternative Chemicals Method   The Additional/Alternative Chemicals Method provides an estimate of the annual environmental load, of chemicals used that are not listed in Table 1 . 1.1.5 The Unique Product Parameters Method, Adjusted Averages Method, and Additional Chemicals Method may be used in combination with each other. 1.2 Instructions are provided for a single-family home. Estimates may be expanded to an aggregate number of single-family homes by assuming an average home size and multiplying by the number of homes. Estimates may be adapted to multi-unit residential buildings by factoring the home parameters for size, occupancy, and fixtures as necessary. 1.3 For the purpose of this practice, environmental load refers to chemical contaminants that may be dissolved or suspended in water. 1.3.1 Estimates of environmental load do not include organic matter common for urine, feces, and vomit. 1.3.2 Estimates of environmental load do not include bulk food waste such as kitchen scraps. 1.3.3 Estimates of environmental load do not include bulk cellulose waste such as toilet paper. 1.3.4 Estimates of environmental load do not include other solid wastes, such as wrappers, not covered by the waste groups covered in 1.3.1 through 1.3.3 . 1.3.5 Actual environmental load may vary depending on types and amounts of chemicals used in a specific home and the number of people in the home. 1.4 The values stated in inch-pound units are to be regarded as standard. No other units of measurement are included in this standard. 1.5 This standard does not purport to address all of the safety concerns, if any, associated with its use. It is the responsibility of the user of this standard to establish appropriate safety, health, and environmental practices and determine the applicability of regulatory limitations prior to use. 1.6 This international standard was developed in accordance with internationally recognized principles on standardization established in the Decision on Principles for the Development of International Standards, Guides and Recommendations issued by the World Trade Organization Technical Barriers to Trade (TBT) Committee. Version""",https://www.astm.org/E2717-18.html
ASTM,ASTM E2738-23,Standard Practice for Digital Imaging and Communication in Nondestructive Evaluation (DICONDE) for Computed Radiography (CR) Test Methods,"""Significance and Use 5.1 Personnel that are responsible for the creation, transfer, and storage of computed radiography NDE data will use this practice. This practice will define a set of information modules that along with the Practice E2339 and the DICOM standard will provide a standard means to organize CR inspection data. The CR inspection data may be displayed and analyzed on any device that conforms to the standard. Personnel wishing to view any CR inspection data stored in accordance with Practice E2339 may use this practice to help them decode and display the data contained in the DICONDE compliant inspection record. Scope 1.1 This practice covers the interoperability of computed radiography (CR) imaging and data acquisition equipment by specifying image data transfer and archival storage methods in commonly accepted terms. This practice is intended to be used in conjunction with Practice E2339 on Digital Imaging and Communication in Nondestructive Evaluation (DICONDE). Practice E2339 defines an industrial adaptation of NEMA PS3  /  ISO 12052 (DICOM, see http://medical.nema.org), an international standard for image data acquisition, review, storage, and archival storage. The goal of Practice E2339, commonly referred to as DICONDE, is to provide a standard that facilitates the display and analysis of NDE results on any system conforming to the DICONDE standard. Toward that end, Practice E2339 provides a data dictionary and a set of information modules that are applicable to all NDE modalities. This practice supplements Practice E2339 by providing information object definitions, information modules and a data dictionary that are specific to computed radiography test methods. 1.2 This practice has been developed to overcome the issues that arise when analyzing or archiving data from CR test equipment using proprietary data transfer and storage methods. As digital technologies evolve, data must remain decipherable through the use of open, industry-wide methods for data transfer and archival storage. This practice defines a method where all standard CR technique parameters and test results are communicated and stored in a standard manner regardless of changes in digital technology. 1.3 This practice does not specify: 1.3.1 A testing or validation procedure to assess an implementation""s conformance to the standard. 1.3.2 The implementation details of any features of the standard on a device claiming conformance. 1.3.3 The overall set of features and functions to be expected from a system implemented by integrating a group of devices each claiming DICONDE conformance. 1.4 Although this practice contains no values that require units, it does describe methods to store and communicate data that do require units to be properly interpreted. The SI units required by this practice are to be regarded as standard. No other units of measurement are included in this practice. 1.5 This standard does not purport to address all of the safety concerns, if any, associated with its use. It is the responsibility of the user of this standard to establish appropriate safety, health, and environmental practices and determine the applicability of regulatory limitations prior to use. 1.6 This international standard was developed in accordance with internationally recognized principles on standardization established in the Decision on Principles for the Development of International Standards, Guides and Recommendations issued by the World Trade Organization Technical Barriers to Trade (TBT) Committee. """,https://www.astm.org/E2738-23.html
ASTM,ASTM E2787-21,Standard Test Method for Determination of Thiodiglycol in Soil Using Pressurized Fluid Extraction Followed by Single Reaction Monitoring Liquid Chromatography/Tandem Mass Spectrometry (LC/MS/MS),"""Significance and Use 5.1 TDG is a Schedule 2 compound under the Chemical Weapons Convention (CWC). Schedule 2 chemicals include those that are precursors to chemical weapons, chemical weapons agents, or have a number of other commercial uses. They are used as ingredients to produce insecticides, herbicides, lubricants, and some pharmaceutical products. Schedule 2 chemicals can be found in applications unrelated to chemical weapons. TDG is both a mustard gas precursor and a degradant as well as an ingredient in water-based inks, ballpoint pen inks, dyes, and some pesticides. 5 5.2 This method has been investigated for use with soil. Scope 1.1 This procedure covers the determination of thiodiglycol (TDG) in soil using pressurized fluid extraction (PFE). A commercially available PFE system 2 is used, followed by analysis using liquid chromatography (LC), and detected with tandem mass spectrometry (MS/MS). TDG is qualitatively and quantitatively determined by this method. This method adheres to single reaction monitoring (SRM) mass spectrometry. 1.2 The method detection limit (MDL) and reporting range for TDG are listed in Table 1 . 1.2.1 The MDL is determined following the Code of Federal Regulations, 40 CFR Part 136, Appendix B. 1.2.2 The reporting limit (RL) is calculated from the concentration of the Level 1 calibration standard as shown in Table 4. The RL for this method is 200 ppb. Reporting range concentrations are calculated from Table 4 concentrations assuming a 5 μL injection of the lowest level calibration standard, 5 g sample, and a 2 mL final extract volume. 1.3 Units   The values stated in SI units are to be regarded as standard. No other units of measurement are included in this standard. 1.4 This standard does not purport to address all of the safety concerns, if any, associated with its use. It is the responsibility of the user of this standard to establish appropriate safety, health, and environmental practices and determine the applicability of regulatory limitations prior to use. 1.5 This international standard was developed in accordance with internationally recognized principles on standardization established in the Decision on Principles for the Development of International Standards, Guides and Recommendations issued by the World Trade Organization Technical Barriers to Trade (TBT) Committee. Version""",https://www.astm.org/E2787-21.html
ASTM,ASTM E2805-18,Standard Practice for Measurement of the Biological Activity of Ricin,"""Significance and Use 5.1 The CFT assay provides a sensitive and reliable method to detect ricin biological activity and results can be generated within 3 h. The assay measures the amount of ricin biological activity when compared to a known ricin standard and provides a quantitative measurement for active ricin. 5.2 The lower limit of quantitation and the upper limit of quantitation for ricin using the CFT assay were measured at 10 ng/mL and 170 ng/mL, respectively ( 5 ) . 5.3 This practice is focused on the measurement of reference materials and not environmental samples. Additional control runs may be needed for measurements of environmental samples to ensure that the presence of additional materials in the samples (also referred to as the matrix) will not interfere with the measurements. 5.4 The CFT assay may be used to determine the presence of active ricin in forensic or bioterrorist samples if the appropriate controls are utilized to ensure valid results ( 5 ) . 5.5 The methods described in this document measure the biological activity of ricin and do not detect the presence of inactivated ricin in a given sample. 5.6 Ricin reference materials have a number of applications, such as testing detection devices, laboratory instruments, environmental sampling methods, disinfection studies, and basic research. Scope 1.1 This guide is intended for the manufacturers and users of ricin reference material. Ricin reference materials are well-characterized materials that can be used to test detection devices and calibrate laboratory measurements. It is anticipated that ricin reference materials will be characterized by biochemical methods in addition to the measurement of biological activity. 1.2 This practice details the measurement of ricin biological activity using a cell-free translation (CFT) assay ( 4 ) . 1.3 The CFT assay has been developed for use in any biotechnology laboratory where determination or confirmation of ricin biological activity is required. 1.4 The CFT assay has been validated by the U.S. Army Medical Research Institute of Infectious Diseases (USAMRIID) VP-016 Validation of Cell-Free Translation Assay for the Detection of Ricin Toxin Biological Activities in compliance ( 5 ) with Good Laboratory Practices (GLP) Regulations of the Food and Drug Administration (21 CFR Part 58). Strict adherence to the protocol is necessary for validity of the test results. 1.5 Appendix X1 and Appendix X2 also provide guidance for the measurement of the biological activity of ricin using cell-based assays and the use of synthetic enzyme substrates. 1.6 Ricin is a category 2 select agent and acquisition of the ricin standard must adhere to the Center for Disease Control and Prevention (CDC) regulations. Ricin is listed on the select agent list (42 CFR Part 72). 3 The possession, transfer, and use of ricin are restricted under the Public Health Security Preparedness Act (CRS Report RL31263 Public Health Security and Bioterrorism Preparedness and Response Act (P.L. 107-188): Provision and Changes to Preexisting law). Access to stores of ricin is limited (USA Patriot Act, P.L. 107-56). Ricin is also a prohibited substance under the Biological Weapons Convention and the Chemical Weapons Convention (CRS Report RL31559 Proliferation Control Regimes: Background and Status). 1.7 The values stated in SI units are to be regarded as standard. No other units of measurement are included in this standard. 1.8 This standard does not purport to address all of the safety concerns, if any, associated with its use. It is the responsibility of the user of this standard to establish appropriate safety, health, and environmental practices and determine the applicability of regulatory limitations prior to use. Ricin is an extremely dangerous toxin. See Section 9 for specific hazards information. 1.9 This international standard was developed in accordance with internationally recognized principles on standardization established in the Decision on Principles for the Development of International Standards, Guides and Recommendations issued by the World Trade Organization Technical Barriers to Trade (TBT) Committee. """,https://www.astm.org/E2805-18.html
ASTM,ASTM E2838-21,Standard Test Method for Determination of Thiodiglycol on Wipes by Solvent Extraction Followed by Liquid Chromatography/Tandem Mass Spectrometry (LC/MS/MS),"""Significance and Use 5.1 This is a performance-based method, and modifications are allowed to improve performance. 5.1.1 Due to the rapid development of newer instrumentation and column chemistries, changes to the analysis described in this standard are allowed as long as better or equivalent performance data result. Any modifications shall be documented and performance data generated. The user of the data generated by this standard shall be made aware of these changes and given the performance data demonstrating better or equivalent performance. 5.2 TDG is a Schedule 2 compound under the Chemical Weapons Convention (CWC). 6 Schedule 2 chemicals include those that are precursors to chemical weapons, chemical weapons agents, or have a number of other non-military commercial uses. Schedule 2 chemicals can also be found in applications unrelated to chemical weapons. These chemicals are used as ingredients to produce insecticides, herbicides, lubricants, and some pharmaceutical products. TDG is a mustard gas precursor and a degradant as well as an ingredient in water-based inks, ballpoint pen inks, dyes, and some pesticides. 5.3 This method has been investigated for use on surface wipes. TDG is also a human metabolite resulting from sulfur mustard exposure but this method has not been investigated for such determinations. Scope 1.1 This procedure details the determination of thiodiglycol (TDG), also known as 2,2  -thiobis-ethanol, on wipes with 3,3  -thiodipropanol (TDP) as the surrogate. This method is based upon solvent extraction of wipes by either sonication or a pressurized fluid extraction (PFE) technique as an alternative option. The extract is filtered, concentrated, and analyzed by liquid chromatography/tandem mass spectrometry (LC/MS/MS). TDG is qualitatively and quantitatively determined. 1.2 Units   The values stated in SI units are to be regarded as standard. No other units of measurement are included in this standard. 1.3 The method detection limit (MDL) 2 and reporting range 3 for TDG are listed in Table 1 . 1.4 This standard does not purport to address all of the safety concerns, if any, associated with its use. It is the responsibility of the user of this standard to establish appropriate safety, health, and environmental practices and determine the applicability of regulatory limitations prior to use. 1.5 This international standard was developed in accordance with internationally recognized principles on standardization established in the Decision on Principles for the Development of International Standards, Guides and Recommendations issued by the World Trade Organization Technical Barriers to Trade (TBT) Committee. Version""",https://www.astm.org/E2838-21.html
ASTM,ASTM E2888-12(2019),Standard Practice for Process for Inactivation of Rodent Retrovirus by pH,"""Scope 1.1 This practice assures 5 log10 inactivation of non-defective C-type retroviruses, which are endogenous to murine hybridoma and CHO cells and are potentially present in the production stream of biopharmaceutical processes that use rodent derived cell culture. 1.2 The process parameters specified in this practice consistently assure 5 log10 inactivation of murine retrovirus by adjusting the pH of a process solution after initial affinity capture chromatography purification. 1.3 This practice is applicable to mAb, IgG fusion, or other recombinant proteins produced from rodent cell lines (for example, CHO or murine hybridoma), which do not target retroviral proteins. Additionally, the low pH step is performed on a cell-free intermediate, post initial capture using protein A chromatography. 1.4 The 5 log10 inactivation of murine retrovirus claimed by using this practice will be utilized in conjunction with other clearance unit operations (for example, chromatography and virus retentive filtration) to assure sufficient total process clearance of murine retroviruses, which will be supportive of early phase regulatory filings. 1.5 The values stated in SI units are to be regarded as standard. No other units of measurement are included in this standard. 1.6 This international standard was developed in accordance with internationally recognized principles on standardization established in the Decision on Principles for the Development of International Standards, Guides and Recommendations issued by the World Trade Organization Technical Barriers to Trade (TBT) Committee. Version""",https://www.astm.org/E2888-12r19.html
