ASD Acronym,Designation,Title of Standard,Abstract,Link
ASTM,ASTM F2042-18,"Standard Guide for Silicone Elastomers, Gels, and Foams Used in Medical Applications Part II—Crosslinking and Fabrication","""Significance and Use 4.1 This guide is intended to provide guidance for the specification and selection of fabrication methods for silicones used in medical devices. It also provides guidance relative to testing that might be done to qualify lots of acceptable material, based on desired performance properties. 4.2 Silicone manufacturers supplying material to the medical device industry should readily provide information regarding non-proprietary product formulation to their customers either directly or through the US FDA Master File program. Scope 1.1 This guide is intended to educate potential users of silicone elastomers, gels and foams relative to their fabrication and processing. It does not provide information relative to silicone powders, fluids, pressure sensitive adhesives, or other types of silicone products. 1.2 The information provided is offered to guide users in the selection of appropriate processing conditions for specific medical device applications. 1.3 Formulation and selection of appropriate starting materials is covered in the companion document, F2038 . This monograph addresses only the curing, post-curing, and processing of elastomers, gels and foams as well as how the resulting product is evaluated. 1.4 Silicone biocompatibility issues can be addressed at several levels, but ultimately the device manufacturer must assess biological suitability relative to intended use. Biocompatibility testing may be done on cured elastomers prior to final fabrication, but the most relevant data are those obtained on the finished device. Data on selected lots of material are only representative when compounding and fabrication are performed under accepted quality systems such as ISO 9001 and current Good Manufacturing Practice Regulations (21 CFR, Parts 210, 211, and 820). Extractables analyses may also be of interest for investigation of biocompatibility, and the procedures for obtaining such data depend on the goal of the study (see ISO  10993  12 and the HIMA Memorandum 7/14/93 for examples of extraction methods). 1.5 The values stated in SI units are to be regarded as standard. The values given in parentheses are mathematical conversions to inch-pound units that are provided for information only and are not considered standard. 1.6 This standard does not purport to address all of the safety concerns, if any, associated with its use. It is the responsibility of the user of this standard to establish appropriate safety, health, and environmental practices and determine the applicability of regulatory limitations prior to use. Users are also advised to refer to Material Safety Data Sheets provided with uncured silicone components. 1.7 This international standard was developed in accordance with internationally recognized principles on standardization established in the Decision on Principles for the Development of International Standards, Guides and Recommendations issued by the World Trade Organization Technical Barriers to Trade (TBT) Committee. """,https://www.astm.org/F2042-18.html
ASTM,ASTM F2052-21,Standard Test Method for Measurement of Magnetically Induced Displacement Force on Medical Devices in the Magnetic Resonance Environment,"""Significance and Use 5.1 This test method is one of those required to determine if the presence of a medical device may cause injury to individuals during an MR examination or in the MR environment. Other safety issues which should be addressed include, but may not be limited to: magnetically induced torque (see Test Method F2213 ) and radiofrequency (RF) heating (see Test Method F2182 ). The terms and icons in Practice F2503 should be used to mark the device for safety in the magnetic resonance environment. 5.2 If the maximum magnetically induced displacement force for the specified magnetic field conditions (see Appendix X3 ) is less than the force on the device due to gravity (its weight), it is assumed that any risk imposed by the application of the magnetically induced force is no greater than any risk imposed by normal daily activity in the Earth  s gravitational field. This statement does not constitute an acceptance criterion; it is provided as a conservative reference point. It is possible that a greater magnetically induced displacement force can be acceptable and would not harm a patient or other individual in a specific case. Note 2: For instance, in the case of an implanted device that is or could be subjected to a magnetic displacement force greater than the force due to gravity, the location of the implant, surrounding tissue properties, and means of fixation within the body may be considered. For a non-implanted device with a magnetically induced force greater than the gravitational force, consideration should be given to mitigate the projectile risk which may include fixing or tethering the device or excluding it from the MR environment so that it does not become a projectile. 5.3 The maximum static magnetic field strength and spatial field gradient vary for different MR systems. Appendix X3 provides guidance for calculating the allowable static magnetic field strength and spatial field gradient. 5.4 This test method alone is not sufficient for determining if a device is safe in the MR environment. Scope 1.1 This test method covers the measurement of the magnetically induced displacement force produced by static magnetic field gradients (spatial field gradient) on medical devices and the comparison of that force to the weight of the medical device. 1.2 This test method does not address other possible safety issues which include, but are not limited to: issues of magnetically induced torque, radiofrequency (RF) heating, induced heating, acoustic noise, interaction among devices, and the functionality of the device and the magnetic resonance (MR) system. 1.3 This test method is intended for devices that can be suspended from a string. Devices which cannot be suspended from a string are not covered by this test method. The weight of the string from which the device is suspended during the test must be less than 1  % of the weight of the tested device. 1.4 This test method shall be carried out in a horizontal bore MR system with a static magnetic field oriented horizontally and parallel to the MR system bore. 1.5 The values stated in SI units are to be regarded as standard. No other units of measurement are included in this standard. 1.6 This standard does not purport to address all of the safety concerns, if any, associated with its use. It is the responsibility of the user of this standard to establish appropriate safety, health, and environmental practices and determine the applicability of regulatory limitations prior to use. 1.7 This international standard was developed in accordance with internationally recognized principles on standardization established in the Decision on Principles for the Development of International Standards, Guides and Recommendations issued by the World Trade Organization Technical Barriers to Trade (TBT) Committee. """,https://www.astm.org/F2052-21.html
ASTM,ASTM F2062-00(2018),Standard Specification for Square Drive Interconnections on Surgical Instruments,"""",https://www.astm.org/F2062-00r18.html
ASTM,ASTM F2063-18,Standard Specification for Wrought Nickel-Titanium Shape Memory Alloys for Medical Devices and Surgical Implants,"""Scope 1.1 This specification covers the chemical, physical, mechanical, and metallurgical requirements for wrought nickel-titanium bar, flat rolled products, and tubes containing nominally 54.5- to 57.0-weight percent nickel and used for the manufacture of medical devices and surgical implants. 1.2 Requirements are for mill product, measuring 5.50 to 94.0 mm [0.218 to 3.70 in.] in diameter or thickness. Mill product is not intended to have the final shape, final surface finish, or final properties of the medical device, implant, or their components. Finished NiTi cold-worked tube should be considered under Specification F2633 . 1.3 The values stated in either SI units or inch-pound units are to be regarded separately as standard. The values stated in each system may not be exact equivalents; therefore, each system shall be used independently of the other. Combining values from the two systems may result in non-conformance with the standard. 1.4 This international standard was developed in accordance with internationally recognized principles on standardization established in the Decision on Principles for the Development of International Standards, Guides and Recommendations issued by the World Trade Organization Technical Barriers to Trade (TBT) Committee. """,https://www.astm.org/F2063-18.html
ASTM,ASTM F2064-17,Standard Guide for Characterization and Testing of Alginates as Starting Materials Intended for Use in Biomedical and Tissue Engineered Medical Product Applications,"""Significance and Use 4.1 This guide contains a listing of those characterization parameters that are directly related to the functionality of alginate. This guide can be used as an aid in the selection and characterization of the appropriate alginate for a particular application. This guide is intended to give guidance in the methods and types of testing necessary to properly characterize, assess, and ensure consistency in the performance of a particular alginate. It may have use in the regulation of these devices by appropriate authorities. 4.2 The alginate covered by this guide may be gelled, extruded, or otherwise formulated into biomedical devices for use in tissue-engineered medical products or drug delivery devices for implantation as determined to be appropriate, based on supporting biocompatibility and physical test data. Recommendations in this guide should not be interpreted as a guarantee of clinical success in any tissue engineered medical product or drug delivery application. Further guidance for immobilizing or encapsulating living cells or tissue in alginate gels can be found in Guide F2315 . 4.3 To ensure that the material supplied satisfies requirements for use in TEMPS, several general areas of characterization should be considered. These are: identity of alginate, physical and chemical characterization and testing, impurities profile, and performance-related tests. Scope 1.1 This guide covers the evaluation of alginates suitable for use in biomedical or pharmaceutical applications, or both, including, but not limited to, Tissue Engineered Medical Products (TEMPs). 1.2 This guide addresses key parameters relevant for the functionality, characterization, and purity of alginates. 1.3 As with any material, some characteristics of alginates may be altered by processing techniques (such as molding, extrusion, machining, assembly, sterilization, and so forth) required for the production of a specific part or device. Therefore, properties of fabricated forms of this polymer should be evaluated using test methods that are appropriate to ensure safety and efficacy and are not addressed in this guide. 1.4 Warning   Mercury has been designated by EPA and many state agencies as a hazardous material that can cause central nervous system, kidney, and liver damage. Mercury, or its vapor, may be hazardous to health and corrosive to materials. Caution should be taken when handling mercury and mercury-containing products. See the applicable product Material Safety Data Sheet (MSDS) for details and EPA  s website (http://www.epa.gov/mercury/faq.htm) for additional information. Users should be aware that selling mercury or mercury-containing products, or both, in your state may be prohibited by state law. 1.5 This standard does not purport to address all of the safety concerns, if any, associated with its use. It is the responsibility of the user of this standard to establish appropriate safety and health practices and determine the applicability of regulatory limitations prior to use. 1.6 This international standard was developed in accordance with internationally recognized principles on standardization established in the Decision on Principles for the Development of International Standards, Guides and Recommendations issued by the World Trade Organization Technical Barriers to Trade (TBT) Committee. """,https://www.astm.org/F2064-17.html
ASTM,ASTM F2065-00(2010),Standard Practice for Testing for Alternative Pathway Complement Activation in Serum by Solid Materials (Withdrawn 2016),"""Biological Issues -- Various biological responses to titanium are presented in six papers.""",https://www.astm.org/F2065-00r10.html
ASTM,ASTM F2081-06(2022),Standard Guide for Characterization and Presentation of the Dimensional Attributes of Vascular Stents,"""Significance and Use 4.1 Vascular stents are intended for permanent implant in the human vasculature (native or graft) for the purposes of maintaining vessel patency. The dimensional attributes of vascular stents are critical parameters that aid clinicians in the selection of devices for individual patients. This guide contains a listing of those dimensional attributes that are directly related to the clinical utility and performance of these devices, along with recommendations for consistent methods of measuring these attributes and presenting the information for use in clinical decision making. This guide can be used by the manufacturers and researchers of stents to provide consistency of measurement and labeling of these dimensional characteristics. It may have use in the regulation of these devices by appropriate authorities. 4.2 The dimensional attributes included in this guide are those that are deemed related to or possibly predictive of successful clinical performance of the stent based on prior clinical experience; however, because of the myriad patient and medical factors that influence the clinical outcome of any individual treatment, conformance of a stent and delivery system with the recommendations in this guide should not be interpreted as a guarantee of clinical success in any individual patient or group of patients. Scope 1.1 This guide covers the identification of and recommended measurement methods for those dimensional attributes of vascular stents that are deemed relevant to successful clinical performance. The delivery system packaged with and labeled specifically for use during the placement of the stent is also included within the scope of this guide. 1.2 This guide addresses only the dimensional characteristics of stents. Material property and stent functional characteristics are not addressed herein. All dimensional characteristics described in this guide refer to in vitro (  bench-top  ) characterization. Because of variable patient factors, for example, vessel compliance, the actual in vivo characteristics may be slightly different. 1.3 This guide includes recommendations generally applicable to balloon-expandable and self-expanding stents fabricated from metals and metal alloys. It does not specifically address any attributes unique to coated stents or polymeric or biodegradable stents, although the application of this guide to those products is not precluded. 1.4 While they are not specifically included within the scope of this guide, stents indicated for placement in nonvascular locations, such as the esophagus or bile duct, also might be characterized by the methods contained herein. Likewise, this guide does not include recommendations for endovascular grafts (  stent-grafts  ) or other conduit devices commonly used to treat aneurysmal disease or peripheral vessel trauma or to provide vascular access, although some information included herein may be applicable to those devices. 1.5 This guide does not include recommendations for balloon catheters sold as stand-alone angioplasty catheters, even though some of those catheters may be used for the delivery of unmounted stents supplied without a delivery system. Requirements for angioplasty catheters are contained in standards ISO 10555-1 and ISO 10555-4. 1.6 The values stated in either SI units or inch-pound units are to be regarded separately as standard. The values stated in each system are not necessarily exact equivalents; therefore, to ensure conformance with the standard, each system shall be used independently of the other, and values from the two systems shall not be combined. 1.6.1 The units of measurements used throughout this guide reflect the hybrid system in common clinical use in the United States as of the time of the original approval of this guide. Since a primary purpose of this guide is to promote uniformity of labeling to facilitate the selection of devices by clinical users, the units most preferred by users were selected for this guide. Where those units are not SI units, or derivatives thereof, SI units are provided in parentheses. 1.7 This international standard was developed in accordance with internationally recognized principles on standardization established in the Decision on Principles for the Development of International Standards, Guides and Recommendations issued by the World Trade Organization Technical Barriers to Trade (TBT) Committee. """,https://www.astm.org/F2081-06r22.html
ASTM,ASTM F2097-23,Standard Guide for Design and Evaluation of Primary Flexible Packaging for Medical Products,"""Significance and Use 4.1 This design and evaluation guide describes multiple categories for evaluating flexible medical packages and packaging materials. These include safety, barrier, material and package performance attributes and characteristics, package integrity, visibility and appearance, processing, printed ink, distribution simulation, and conditioning. 4.2 The intent of this design and evaluation guide is to evaluate all cited categories and select those that are applicable. Once the product has been characterized and the sterilization methodology has been defined, there are numerous sets of requirements for any specific package. This design and evaluation guide provides an avenue for assessing these requirements and choosing test methods for both evaluating the package design and monitoring package compliance. Note 1: Many of the standards included in this guide are consensus standards that are recognized by the United States Food and Drug Administration (FDA). Selection and use of a U.S. FDA recognized consensus standard is voluntary and the sole responsibility of the user in determining its applicability. For further information, consult the U.S. FDA Standards and Conformity Assessment Program at https://www.fda.gov/medical-devices/device-advice-comprehensive-regulatoryassistance/standards-and-conformity-assessment-program 4.3 Product characterization shall include mass or weight, geometry (length and width, height, and shape) and product composition. 4.4 All categories must be considered for applicability. 4.5 The Summary of Test Methods for Medical Packaging Design and Evaluation ( Fig. 1 ) provides a compact graphical presentation of the test methods referenced in this guide. Scope 1.1 This guide provides directions for the design and evaluation of primary flexible packages for medical products. The package materials must be selected appropriately for manufacturing process, end use, and the product being packaged. 1.2 This guide provides a compendium of test methods, practices, and procedures. Specific individual test methods must be selected based on the pertinent characteristics of the specific product to be packaged and the purpose for testing, research and development, or compliance. Not all test methods will be applicable. 1.3 This guide does not address acceptability criteria, which need to be determined jointly by the package producer and the medical products manufacturer. 1.4 This guide does not assess the product to be packaged or the sterilization method to be used. 1.5 The units cited in the referenced standard should be used. 1.6 This international standard was developed in accordance with internationally recognized principles on standardization established in the Decision on Principles for the Development of International Standards, Guides and Recommendations issued by the World Trade Organization Technical Barriers to Trade (TBT) Committee. Version""",https://www.astm.org/F2097-23.html
ASTM,ASTM F2100-23,Standard Specification for Performance of Materials Used in Medical Face Masks,"""Scope 1.1 This specification covers testing and requirements for materials used in the construction of medical face masks that are used in providing healthcare services such as surgery and patient care. 1.1.1 This specification addresses medical masks with ties (surgical masks) and ear loops (procedure masks or isolation masks). 1.2 This specification provides for the classification of medical face mask material performance. Medical face mask material performance is based on testing for bacterial filtration efficiency, differential pressure, sub-micron particulate filtration efficiency, resistance to penetration by synthetic blood, and flammability. 1.3 This specification does not address all aspects of medical face mask design and performance. This specification does not specifically evaluate the effectiveness of medical face mask designs as related to their overall barrier and breathability properties. 1.3.1 This specification does not include any specific design criteria for medical face masks; however, surgical masks are differentiated by having ties to allow adjustment of the medical face mask fit in comparison to procedure or isolation masks, which use ear loops to affix the mask to the wearer  s face. 1.4 This specification does not address requirements for regulated respiratory protection devices such as respirators, which may be necessary for some healthcare services and exposure to inhalation hazards. Note 1: Performance requirements for NIOSH-approved N95 respirators are described in 42 CFR Part 84. Additional requirements for NIOSH-approved N95 respirators intended for use in healthcare settings are described in the Memorandum of Understanding between FDA and NIOSH. FDA/NIOSH MOU 225-18-006, November 2017 and the NIOSH Conformity Assessment Letter to Manufacturers, NIOSH CA 2018-1010, November 2018. 1.5 The values stated in SI units are to be regarded as standard. No other units of measurement are included in this standard. 1.6 The following precautionary caveat pertains only to the test methods portion, Section 9, of this specification: This standard does not purport to address all of the safety concerns, if any, associated with its use. It is the responsibility of the user of this standard to establish appropriate safety, health, and environmental practices and determine the applicability of regulatory limitations prior to use. 1.7 This international standard was developed in accordance with internationally recognized principles on standardization established in the Decision on Principles for the Development of International Standards, Guides and Recommendations issued by the World Trade Organization Technical Barriers to Trade (TBT) Committee. """,https://www.astm.org/F2100-23.html
